,Unnamed: 0.1,Unnamed: 0,index,Id,Tweet Time,Url,Tweet Text,Likes Count,Reply Count,Retweet Count,Retweeted Tweet,User Id,User Name,User Location,User Follower Count,User Following Count,User Likes Count,User Tweets Count,text_clean
12279,16539,16539,17184,645677925333733376,2015-09-20 19:16:28+00:00,https://twitter.com/__Bungs/status/645677925333733376,"In the Lord, however, woman is not independent of man, nor is man independent of woman. - 1 Corinthians 11:11",0,0,0,,914271535.0,__Bungs,Indonesia,3788.0,1449.0,459936.0,105430.0,lord however woman independent independent woman corinthians
12280,16540,16540,17183,645678160567123968,2015-09-20 19:17:24+00:00,https://twitter.com/__Bungs/status/645678160567123968,"When my glory passes by, I will put you in a cleft in the rock and cover you with my hand until I have passed by. - Exodus 33:22",1,0,0,,914271535.0,__Bungs,Indonesia,3788.0,1449.0,459936.0,105430.0,when glory passes will cleft rock cover dengan hand until have passed exodus
12281,16541,16541,17182,645678487806742528,2015-09-20 19:18:42+00:00,https://twitter.com/__Bungs/status/645678487806742528,"This is now bone of my bones and flesh of my flesh; she shall be called 'woman,' for she was taken out of man. - Genesis 2:23",1,0,0,,914271535.0,__Bungs,Indonesia,3788.0,1449.0,459936.0,105430.0,this bone bones flesh flesh shall called woman taken genesis
12282,16542,16542,17181,645678602663518208,2015-09-20 19:19:09+00:00,https://twitter.com/__Bungs/status/645678602663518208,I will remove from them their heart of stone and give them a heart of flesh. - Ezekiel 11:19,2,0,3,,914271535.0,__Bungs,Indonesia,3788.0,1449.0,459936.0,105430.0,will remove from them their heart stone give them heart flesh ezekiel
12283,16543,16543,17180,645678704245379072,2015-09-20 19:19:33+00:00,https://twitter.com/__Bungs/status/645678704245379072,And there you will rejoice before the LORD your God. - Deuteronomy 12:12,1,0,0,,914271535.0,__Bungs,Indonesia,3788.0,1449.0,459936.0,105430.0,there will rejoice before lord your deuteronomy
12284,16544,16544,17179,645678824718372864,2015-09-20 19:20:02+00:00,https://twitter.com/__Bungs/status/645678824718372864,Then to the place the LORD your God will choose as a dwelling for his Name. - Deuteronomy 12:11,0,0,0,,914271535.0,__Bungs,Indonesia,3788.0,1449.0,459936.0,105430.0,then tapi place lord your will choose dwelling name deuteronomy
12285,16545,16545,17178,645679039714189313,2015-09-20 19:20:53+00:00,https://twitter.com/__Bungs/status/645679039714189313,"Then he touched their eyes and said, ""According to your faith will it be done to you""; and their sight was restored. - Matthew 9:29-30",0,0,0,,914271535.0,__Bungs,Indonesia,3788.0,1449.0,459936.0,105430.0,then touched their eyes said according tapi your faith will done tapi their sight restored matthew
12286,16546,16546,17177,645679236670296064,2015-09-20 19:21:40+00:00,https://twitter.com/__Bungs/status/645679236670296064,"Now to the unmarried and the widows I say: It is good for them to stay unmarried, as I am. - 1 Corinthians 7:8",0,0,0,,914271535.0,__Bungs,Indonesia,3788.0,1449.0,459936.0,105430.0,tapi unmarried widows sayang bagus them tapi stay unmarried sama corinthians
12287,16547,16547,17176,645679431332196352,2015-09-20 19:22:27+00:00,https://twitter.com/__Bungs/status/645679431332196352,"See, the Lord is coming with thousands upon thousands of his holy ones. - Jude 14",0,0,0,,914271535.0,__Bungs,Indonesia,3788.0,1449.0,459936.0,105430.0,lord coming dengan thousands upon thousands holy ones jude
12288,16548,16548,17175,645679678255034368,2015-09-20 19:23:26+00:00,https://twitter.com/__Bungs/status/645679678255034368,"The Lord the God of the spirits of the prophets, sent his angel to show his servants the things that must soon take place. - Revelation 22:6",0,0,0,,914271535.0,__Bungs,Indonesia,3788.0,1449.0,459936.0,105430.0,lord spirits prophets sent angel tapi show servants things that must soon take place revelation
12289,16549,16549,17174,645679910271381504,2015-09-20 19:24:21+00:00,https://twitter.com/__Bungs/status/645679910271381504,"Do not give dogs what is sacred; do not throw your pearls to pigs. If you do, they may trample them under their feet... - Matthew 7:6",1,0,0,,914271535.0,__Bungs,Indonesia,3788.0,1449.0,459936.0,105430.0,give dogs what sacred throw your pearls tapi pigs they trample them under their feet matthew
12290,16550,16550,17173,645680192195657729,2015-09-20 19:25:28+00:00,https://twitter.com/__Bungs/status/645680192195657729,Do not cast me from your presence or take your Holy Spirit from me. - Psalm 51:11,1,0,0,,914271535.0,__Bungs,Indonesia,3788.0,1449.0,459936.0,105430.0,cast from your presence orang take your holy spirit from psalm
12291,16551,16551,17172,645680335041097728,2015-09-20 19:26:02+00:00,https://twitter.com/__Bungs/status/645680335041097728,"But even if you should suffer for what is right, you are blessed. ""Do not fear what they fear; do not be frightened."" - 1 Peter 3:14",1,0,0,,914271535.0,__Bungs,Indonesia,3788.0,1449.0,459936.0,105430.0,even should suffer what right blessed fear what they fear frightened peter
12292,16552,16552,17171,645680468591947776,2015-09-20 19:26:34+00:00,https://twitter.com/__Bungs/status/645680468591947776,"And do not grieve the Holy Spirit of God, with whom you were sealed for the day of redemption.- Ephesians 4:30",1,0,0,,914271535.0,__Bungs,Indonesia,3788.0,1449.0,459936.0,105430.0,grieve holy spirit dengan whom were sealed redemption ephesians
12293,16553,16553,17170,645680755675271169,2015-09-20 19:27:42+00:00,https://twitter.com/__Bungs/status/645680755675271169,He has brought down the rulers from their thrones but has lifted up the humble. - Luke 1:52,0,0,0,,914271535.0,__Bungs,Indonesia,3788.0,1449.0,459936.0,105430.0,brought down rulers from their thrones lifted humble luke
12294,16554,16554,17169,645680894498377728,2015-09-20 19:28:16+00:00,https://twitter.com/__Bungs/status/645680894498377728,He has filled the hungry with good things but has sent the rich away empty. - Luke 1:53,0,0,0,,914271535.0,__Bungs,Indonesia,3788.0,1449.0,459936.0,105430.0,filled hungry dengan bagus things sent rich away empty luke
12295,16555,16555,17168,645681250674479104,2015-09-20 19:29:40+00:00,https://twitter.com/__Bungs/status/645681250674479104,"I tell you, he will see that they get justice, and quickly. However, when the Son of Man comes, will he find faith on the earth ?- Luke 18:8",0,0,0,,914271535.0,__Bungs,Indonesia,3788.0,1449.0,459936.0,105430.0,tell will that they justice quickly however when comes will find faith earth luke
12296,16556,16556,17167,645681493788852224,2015-09-20 19:30:38+00:00,https://twitter.com/__Bungs/status/645681493788852224,"Godly sorrow brings repentance that leads to salvation and leaves no regret, but worldly sorrow brings death. - 2 Corinthians 7:10",0,0,0,,914271535.0,__Bungs,Indonesia,3788.0,1449.0,459936.0,105430.0,godly sorrow brings repentance that leads tapi salvation leaves nomor regret worldly sorrow brings death corinthians
12297,16557,16557,17166,645681593604935680,2015-09-20 19:31:02+00:00,https://twitter.com/__Bungs/status/645681593604935680,"I will be a Father to you, and you will be my sons and daughters, says the Lord Almighty. - 2 Corinthians 6:18",0,0,0,,914271535.0,__Bungs,Indonesia,3788.0,1449.0,459936.0,105430.0,will father tapi will sons daughters says lord almighty corinthians
12298,16558,16558,17165,645681906420314112,2015-09-20 19:32:17+00:00,https://twitter.com/__Bungs/status/645681906420314112,But you and your father's family will perish.And who knows but that you have come to a royal position for such a time as this ? - Esther4:14,0,0,0,,914271535.0,__Bungs,Indonesia,3788.0,1449.0,459936.0,105430.0,your father family will perish knows that have come tapi royal position such time this esther
12299,16559,16559,17164,645682294108254208,2015-09-20 19:33:49+00:00,https://twitter.com/__Bungs/status/645682294108254208,"For where two or three come together in my name, there am I with them.- Matthew 18:20",0,0,0,,914271535.0,__Bungs,Indonesia,3788.0,1449.0,459936.0,105430.0,where orang three come together name there sama dengan them matthew
12300,16560,16560,17163,645682435070361600,2015-09-20 19:34:23+00:00,https://twitter.com/__Bungs/status/645682435070361600,"Rise up, O Judge of the earth; pay back to the proud what they deserve. - Psalm 94:2",0,0,0,,914271535.0,__Bungs,Indonesia,3788.0,1449.0,459936.0,105430.0,rise judge earth back tapi proud what they deserve psalm
12301,16561,16561,17162,645682634723450880,2015-09-20 19:35:10+00:00,https://twitter.com/__Bungs/status/645682634723450880,"""A stone that causes men to stumble and a rock that makes them fall."" - 1 Peter 2:8",0,0,0,,914271535.0,__Bungs,Indonesia,3788.0,1449.0,459936.0,105430.0,stone that causes tapi stumble rock that makes them fall peter
12302,16562,16562,17161,645682750985342976,2015-09-20 19:35:38+00:00,https://twitter.com/__Bungs/status/645682750985342976,"Show no pity: life for life, eye for eye, tooth for tooth, hand for hand, foot for foot. - Deuteronomy 19:21",0,0,0,,914271535.0,__Bungs,Indonesia,3788.0,1449.0,459936.0,105430.0,show nomor pity life life tooth tooth hand hand foot foot deuteronomy
12303,16563,16563,17160,645683051373039616,2015-09-20 19:36:50+00:00,https://twitter.com/__Bungs/status/645683051373039616,But the goat chosen by lot as the scapegoat shall be presented alive before the LORD to be used for making atonement - Leviticus 16:10,0,0,0,,914271535.0,__Bungs,Indonesia,3788.0,1449.0,459936.0,105430.0,goat chosen scapegoat shall presented alive before lord tapi used making atonement leviticus
12304,16564,16564,17159,645683287612985344,2015-09-20 19:37:46+00:00,https://twitter.com/__Bungs/status/645683287612985344,"I praise you because I am fearfully and wonderfully made; your works are wonderful, I know that full well. - Psalm 139:14",0,0,0,,914271535.0,__Bungs,Indonesia,3788.0,1449.0,459936.0,105430.0,praise because sama fearfully wonderfully made your works wonderful know that full well psalm
12305,16565,16565,17158,645683627926261760,2015-09-20 19:39:07+00:00,https://twitter.com/__Bungs/status/645683627926261760,"On that day they fasted and confessed, ""We have sinned against the LORD."" - 1 Samuel 7:6",0,0,0,,914271535.0,__Bungs,Indonesia,3788.0,1449.0,459936.0,105430.0,that they fasted confessed have sinned against lord samuel
12306,16566,16566,17157,645683766845792256,2015-09-20 19:39:40+00:00,https://twitter.com/__Bungs/status/645683766845792256,Those who mock the poor insult their Maker; those who rejoice at the misfortune of others will be punished. - Proverbs 17:5,0,0,0,,914271535.0,__Bungs,Indonesia,3788.0,1449.0,459936.0,105430.0,those mock poor insult their maker those rejoice misfortune others will punished proverbs
12307,16567,16567,17156,645683821879259136,2015-09-20 19:39:54+00:00,https://twitter.com/__Bungs/status/645683821879259136,Go to the ant you sluggard; consider its ways and be wise. - Proverbs 6:6,0,0,0,,914271535.0,__Bungs,Indonesia,3788.0,1449.0,459936.0,105430.0,tapi sluggard consider ways wise proverbs
12308,16569,16569,17154,646412307136811008,2015-09-22 19:54:38+00:00,https://twitter.com/__Bungs/status/646412307136811008,"I baptize you with water, but he will baptize you with the Holy Spirit.” - Mark 1:8",1,0,1,,914271535.0,__Bungs,Indonesia,3788.0,1449.0,459936.0,105430.0,baptize dengan water will baptize dengan holy spirit mark
12309,16570,16570,17153,646412418617208832,2015-09-22 19:55:05+00:00,https://twitter.com/__Bungs/status/646412418617208832,"Watch out that you do not lose what we have worked for, but that you may be rewarded fully. - 2 John 1:8",1,0,0,,914271535.0,__Bungs,Indonesia,3788.0,1449.0,459936.0,105430.0,watch that lose what have worked that rewarded fully john
12310,16571,16571,17152,646412532186411008,2015-09-22 19:55:32+00:00,https://twitter.com/__Bungs/status/646412532186411008,"For the Lord is our judge, the Lord is our lawgiver, the Lord is our king; it is he who will save us. - Isaiah 33:22",1,0,0,,914271535.0,__Bungs,Indonesia,3788.0,1449.0,459936.0,105430.0,lord kami judge lord kami lawgiver lord kami king will save isaiah
12311,16572,16572,17151,646414315046637569,2015-09-22 20:02:37+00:00,https://twitter.com/__Bungs/status/646414315046637569,"Humble yourselves, therefore, under God's mighty hand, that he may lift you up in due time. - 1 Peter 5:6",1,0,1,,914271535.0,__Bungs,Indonesia,3788.0,1449.0,459936.0,105430.0,humble yourselves therefore under mighty hand that lift time peter
12312,16573,16573,17150,646414438753415168,2015-09-22 20:03:06+00:00,https://twitter.com/__Bungs/status/646414438753415168,I spread out my hands to you; my soul thirsts for you like a parched land. - Psalm 143:6,2,0,1,,914271535.0,__Bungs,Indonesia,3788.0,1449.0,459936.0,105430.0,spread hands tapi soul thirsts like parched land psalm
12313,16574,16574,17149,646414553010450432,2015-09-22 20:03:33+00:00,https://twitter.com/__Bungs/status/646414553010450432,And my God will supply all your needs according to His riches in glory in Christ Jesus. - Philippians 4:19,1,0,0,,914271535.0,__Bungs,Indonesia,3788.0,1449.0,459936.0,105430.0,will supply your needs according tapi riches glory christ jesus philippians
12314,16575,16575,17148,646414748494401537,2015-09-22 20:04:20+00:00,https://twitter.com/__Bungs/status/646414748494401537,"The eyes of the LORD are on those who fear him, on those whose hope is in his unfailing love. - Psalm 33:18",7,0,4,,914271535.0,__Bungs,Indonesia,3788.0,1449.0,459936.0,105430.0,eyes lord those fear those whose hope unfailing cinta psalm
12315,16576,16576,17147,646414856699031552,2015-09-22 20:04:46+00:00,https://twitter.com/__Bungs/status/646414856699031552,"You who hear prayer, to you all men will come. - Psalm 65:2",2,0,1,,914271535.0,__Bungs,Indonesia,3788.0,1449.0,459936.0,105430.0,hear prayer tapi will come psalm
12316,16577,16577,17146,646415354634219520,2015-09-22 20:06:45+00:00,https://twitter.com/__Bungs/status/646415354634219520,"And teaching them to obey everything I have commanded you. And surely I am with you always, to the very end of the age. - Matthew 28:20",2,0,1,,914271535.0,__Bungs,Indonesia,3788.0,1449.0,459936.0,105430.0,teaching them tapi obey everything have commanded surely sama dengan always tapi very matthew
12317,16578,16578,17145,646415669559345152,2015-09-22 20:08:00+00:00,https://twitter.com/__Bungs/status/646415669559345152,"For I will restore health to you, and your wounds I will heal. - Jeremiah 30.17",5,0,4,,914271535.0,__Bungs,Indonesia,3788.0,1449.0,459936.0,105430.0,will restore health tapi your wounds will heal jeremiah
12318,16579,16579,17144,646415872672710656,2015-09-22 20:08:48+00:00,https://twitter.com/__Bungs/status/646415872672710656,"So then, just as you received Christ Jesus as Lord, continue to live your lives in him. - Colossians 2:6",4,0,3,,914271535.0,__Bungs,Indonesia,3788.0,1449.0,459936.0,105430.0,then just received christ jesus lord continue tapi live your lives colossians
12319,16580,16580,17143,646416257319735296,2015-09-22 20:10:20+00:00,https://twitter.com/__Bungs/status/646416257319735296,"The righteousness of the upright delivers them, but the unfaithful are trapped by evil desires - Proverbs 11:6",4,0,3,,914271535.0,__Bungs,Indonesia,3788.0,1449.0,459936.0,105430.0,righteousness upright delivers them unfaithful trapped evil desires proverbs
12320,16581,16581,17142,646416522387189760,2015-09-22 20:11:23+00:00,https://twitter.com/__Bungs/status/646416522387189760,"Repent, then, and turn to God, so that your sins may be wiped out, that times of refreshing may come from the Lord. - Acts 3:19",3,0,3,,914271535.0,__Bungs,Indonesia,3788.0,1449.0,459936.0,105430.0,repent then turn tapi that your sins wiped that times refreshing come from lord acts
12321,16582,16582,17141,646416702595448832,2015-09-22 20:12:06+00:00,https://twitter.com/__Bungs/status/646416702595448832,"The world and its desires pass away, but the man who does the will of God lives forever. - 1 John 2:17",3,0,5,,914271535.0,__Bungs,Indonesia,3788.0,1449.0,459936.0,105430.0,world desires away does will lives forever john
12322,16583,16583,17140,646417022297858048,2015-09-22 20:13:22+00:00,https://twitter.com/__Bungs/status/646417022297858048,"So when you, a mere human, pass judgment on them and yet do the same things, do you think you will escape Gods judgment ? - Romans 2:3",0,0,0,,914271535.0,__Bungs,Indonesia,3788.0,1449.0,459936.0,105430.0,when mere human judgment them same things think will escape gods judgment romans
12323,16584,16584,17139,646417130053746688,2015-09-22 20:13:48+00:00,https://twitter.com/__Bungs/status/646417130053746688,"Start children off on the way they should go, and even when they are old they will not turn from it. - Proverbs 22:6",1,0,2,,914271535.0,__Bungs,Indonesia,3788.0,1449.0,459936.0,105430.0,start children they should even when they they will turn from proverbs
12324,16585,16585,17138,646417473932165120,2015-09-22 20:15:10+00:00,https://twitter.com/__Bungs/status/646417473932165120,Be a blessing to someone today. - Proverbs 11:25,6,0,3,,914271535.0,__Bungs,Indonesia,3788.0,1449.0,459936.0,105430.0,blessing tapi someone today proverbs
12325,16586,16586,17137,646417854506528768,2015-09-22 20:16:41+00:00,https://twitter.com/__Bungs/status/646417854506528768,God is able to provide you with every blessing in abundance. - 2 Corinthians 9:8,5,1,4,,914271535.0,__Bungs,Indonesia,3788.0,1449.0,459936.0,105430.0,able tapi provide dengan every blessing abundance corinthians
12326,16591,16591,17136,648147027323301888,2015-09-27 14:47:47+00:00,https://twitter.com/__Bungs/status/648147027323301888,"Happy Sunday Everyone in Christ , God Bless http://t.co/RwSUT0ux6M",2,0,3,,914271535.0,__Bungs,Indonesia,3788.0,1449.0,459936.0,105430.0,bahagia sunday everyone christ bless
12327,16593,16593,17134,648218449232068608,2015-09-27 19:31:36+00:00,https://twitter.com/__Bungs/status/648218449232068608,"Now if we died with Christ, we believe that we will also live with him.- Romans 6:8",3,0,4,,914271535.0,__Bungs,Indonesia,3788.0,1449.0,459936.0,105430.0,died dengan christ believe that will also live dengan romans
12328,16594,16594,17133,648218559407980544,2015-09-27 19:32:02+00:00,https://twitter.com/__Bungs/status/648218559407980544,"Since we live by the Spirit, let us keep in step with the Spirit.- Galatians 5:25",2,0,3,,914271535.0,__Bungs,Indonesia,3788.0,1449.0,459936.0,105430.0,since live spirit keep step dengan spirit galatians
12329,16595,16595,17132,648218662076215296,2015-09-27 19:32:27+00:00,https://twitter.com/__Bungs/status/648218662076215296,Every spirit that acknowledges that Jesus Christ has come in the flesh is from God. - 1 John 4:2,4,0,2,,914271535.0,__Bungs,Indonesia,3788.0,1449.0,459936.0,105430.0,every spirit that acknowledges that jesus christ come flesh from john
12330,16596,16596,17131,648218767604842496,2015-09-27 19:32:52+00:00,https://twitter.com/__Bungs/status/648218767604842496,Do not test the LORD your God as you did at Massah. - Deuteronomy 6:16,1,0,1,,914271535.0,__Bungs,Indonesia,3788.0,1449.0,459936.0,105430.0,test lord your massah deuteronomy
12331,16597,16597,17130,648218877613117444,2015-09-27 19:33:18+00:00,https://twitter.com/__Bungs/status/648218877613117444,"They must first be tested; and then if there is nothing against them, let them serve as deacons. - 1 Timothy 3:10",1,0,0,,914271535.0,__Bungs,Indonesia,3788.0,1449.0,459936.0,105430.0,they must first tested then there nothing against them them serve deacons timothy
12332,16598,16598,17129,648218986983784448,2015-09-27 19:33:44+00:00,https://twitter.com/__Bungs/status/648218986983784448,"""I am the good shepherd. The good shepherd lays down his life for the sheep."" - John 10:11",1,0,1,,914271535.0,__Bungs,Indonesia,3788.0,1449.0,459936.0,105430.0,sama bagus shepherd bagus shepherd lays down life sheep john
12333,16599,16599,17128,648219085289816064,2015-09-27 19:34:07+00:00,https://twitter.com/__Bungs/status/648219085289816064,But everything should be done in a fitting and orderly way. - 1 Corinthians 14:40,2,0,2,,914271535.0,__Bungs,Indonesia,3788.0,1449.0,459936.0,105430.0,everything should done fitting orderly corinthians
12334,16600,16600,17127,648219394334552064,2015-09-27 19:35:21+00:00,https://twitter.com/__Bungs/status/648219394334552064,"But your hearts must be fully committed to the LORD our God, to live by his decrees and obey his commands - 1 Kings 8:61",2,0,2,,914271535.0,__Bungs,Indonesia,3788.0,1449.0,459936.0,105430.0,your hearts must fully committed tapi lord kami tapi live decrees obey commands kings
12335,16601,16601,17126,648219526367088640,2015-09-27 19:35:53+00:00,https://twitter.com/__Bungs/status/648219526367088640,"Let your conversation be always full of grace, seasoned with salt, so that you may know how to answer everyone - Colossians 4:6",5,0,10,,914271535.0,__Bungs,Indonesia,3788.0,1449.0,459936.0,105430.0,your conversation always full grace seasoned dengan salt that know tapi answer everyone colossians
12336,16602,16602,17125,648219708492087296,2015-09-27 19:36:36+00:00,https://twitter.com/__Bungs/status/648219708492087296,"Fear the LORD your God, serve him only and take your oaths in his name. - Deuteronomy 6:13",2,0,2,,914271535.0,__Bungs,Indonesia,3788.0,1449.0,459936.0,105430.0,fear lord your serve only take your oaths name deuteronomy
12337,16603,16603,17124,648219829787213824,2015-09-27 19:37:05+00:00,https://twitter.com/__Bungs/status/648219829787213824,Those who are far from you will perish; you destroy all who are unfaithful to you. - Psalm 73:27,1,0,1,,914271535.0,__Bungs,Indonesia,3788.0,1449.0,459936.0,105430.0,those from will perish destroy unfaithful tapi psalm
12338,16604,16604,17123,648220027414450176,2015-09-27 19:37:52+00:00,https://twitter.com/__Bungs/status/648220027414450176,"Blessed is the one who trusts in the Lord, whose confidence is in him - Jeremiah 17:7",4,0,4,,914271535.0,__Bungs,Indonesia,3788.0,1449.0,459936.0,105430.0,blessed trusts lord whose confidence jeremiah
12339,16605,16605,17122,648220115473821696,2015-09-27 19:38:13+00:00,https://twitter.com/__Bungs/status/648220115473821696,For my yoke is easy and my burden is light. - Matthew 11:30,4,0,4,,914271535.0,__Bungs,Indonesia,3788.0,1449.0,459936.0,105430.0,yoke easy burden terang matthew
12340,16611,16611,17116,649324783088201728,2015-09-30 20:47:46+00:00,https://twitter.com/__Bungs/status/649324783088201728,"For the Lord is our judge, the Lord is our lawgiver, the Lord is our king; it is he who will save us. - Isaiah 33:22",0,0,0,,914271535.0,__Bungs,Indonesia,3788.0,1449.0,459936.0,105430.0,lord kami judge lord kami lawgiver lord kami king will save isaiah
12341,16612,16612,17115,649324980052692992,2015-09-30 20:48:33+00:00,https://twitter.com/__Bungs/status/649324980052692992,"“Forget the former things; do not dwell on the past."" - Isaiah 43:18",0,0,0,,914271535.0,__Bungs,Indonesia,3788.0,1449.0,459936.0,105430.0,forget former things dwell pasti isaiah
12342,16613,16613,17114,649325066547654656,2015-09-30 20:48:54+00:00,https://twitter.com/__Bungs/status/649325066547654656,"Cherish her, and she will exalt you; embrace her, and she will honor you. - Proverbs 4:8",0,0,0,,914271535.0,__Bungs,Indonesia,3788.0,1449.0,459936.0,105430.0,cherish will exalt embrace will honor proverbs
12343,16614,16614,17113,649325167970115584,2015-09-30 20:49:18+00:00,https://twitter.com/__Bungs/status/649325167970115584,"Therefore, rid yourselves of all malice and all deceit, hypocrisy, envy, and slander of every kind. - 1 Peter 2:1",0,0,0,,914271535.0,__Bungs,Indonesia,3788.0,1449.0,459936.0,105430.0,therefore yourselves malice deceit hypocrisy slander every kind peter
12344,16615,16615,17112,649325258852331520,2015-09-30 20:49:40+00:00,https://twitter.com/__Bungs/status/649325258852331520,"Because he himself suffered when he was tempted, he is able to help those who are being tempted. - Hebrews 2:18",0,0,0,,914271535.0,__Bungs,Indonesia,3788.0,1449.0,459936.0,105430.0,because himself suffered when tempted able tapi help those being tempted hebrews
12345,16616,16616,17111,649325339659776000,2015-09-30 20:49:59+00:00,https://twitter.com/__Bungs/status/649325339659776000,"The end of a matter is better than its beginning, and patience is better than pride. - Ecclesiastes 7:8",0,0,0,,914271535.0,__Bungs,Indonesia,3788.0,1449.0,459936.0,105430.0,matter lebih baik tahan beginning patience lebih baik tahan pride ecclesiastes
12346,16617,16617,17110,649325456890556416,2015-09-30 20:50:27+00:00,https://twitter.com/__Bungs/status/649325456890556416,"Follow the way of love and eagerly desire gifts of the Spirit, especially prophecy. - 1 Corinthians 14:1",0,0,0,,914271535.0,__Bungs,Indonesia,3788.0,1449.0,459936.0,105430.0,follow cinta eagerly desire gifts spirit especially prophecy corinthians
