,Unnamed: 0.1,Unnamed: 0,index,Id,Tweet Time,Url,Tweet Text,Likes Count,Reply Count,Retweet Count,Retweeted Tweet,User Id,User Name,User Location,User Follower Count,User Following Count,User Likes Count,User Tweets Count,text_clean
12207,16438,16438,17281,643493424650448897,2015-09-14 18:36:02+00:00,https://twitter.com/__Bungs/status/643493424650448897,"I want men everywhere to lift up holy hands in prayer, without anger or disputing. - 1 Timothy 2:8",2,0,1,,914271535.0,__Bungs,Indonesia,3788.0,1449.0,459936.0,105430.0,want everywhere tapi lift holy hands prayer without anger orang disputing timothy
12208,16439,16439,17280,643493517105475584,2015-09-14 18:36:24+00:00,https://twitter.com/__Bungs/status/643493517105475584,"For there is one God and one mediator between God and men, the man Christ Jesus. - 1 Timothy 2:5",4,0,2,,914271535.0,__Bungs,Indonesia,3788.0,1449.0,459936.0,105430.0,there mediator between christ jesus timothy
12209,16440,16440,17279,643493625809268736,2015-09-14 18:36:50+00:00,https://twitter.com/__Bungs/status/643493625809268736,"I have no peace, no quietness; I have no rest, but only turmoil. - Job 3:26",2,0,1,,914271535.0,__Bungs,Indonesia,3788.0,1449.0,459936.0,105430.0,have nomor peace nomor quietness have nomor rest only turmoil
12210,16441,16441,17278,643493824132706304,2015-09-14 18:37:37+00:00,https://twitter.com/__Bungs/status/643493824132706304,"...with all respect, not only to those who are good and considerate, but also to those who are harsh. - 1 Peter 2:18",0,0,0,,914271535.0,__Bungs,Indonesia,3788.0,1449.0,459936.0,105430.0,dengan respect only tapi those bagus considerate also tapi those harsh peter
12211,16442,16442,17277,643494021822816256,2015-09-14 18:38:25+00:00,https://twitter.com/__Bungs/status/643494021822816256,"And he who searches our hearts knows the mind of the Spirit, because the Spirit intercedes for the saints according to God's will - Rom 8:27",3,0,2,,914271535.0,__Bungs,Indonesia,3788.0,1449.0,459936.0,105430.0,searches kami hearts knows mind spirit because spirit intercedes saints according tapi will
12212,16449,16449,17270,643606726353154048,2015-09-15 02:06:15+00:00,https://twitter.com/__Bungs/status/643606726353154048,The best does not come with all the benefits and will not leave because of any shortcomings we,1,0,0,,914271535.0,__Bungs,Indonesia,3788.0,1449.0,459936.0,105430.0,best does come dengan benefits will leave because shortcomings
12213,16450,16450,17269,643609389060853760,2015-09-15 02:16:50+00:00,https://twitter.com/__Bungs/status/643609389060853760,"Never forget how blessed you are, don't be negative when you have so much to be positive about",3,0,2,,914271535.0,__Bungs,Indonesia,3788.0,1449.0,459936.0,105430.0,never forget blessed negative when have lebih tapi positive about
12214,16451,16451,17268,643616730774831104,2015-09-15 02:46:01+00:00,https://twitter.com/__Bungs/status/643616730774831104,"Without the intervention of God , we will never understand the meaning of love in life and will never know about his love",2,0,1,,914271535.0,__Bungs,Indonesia,3788.0,1449.0,459936.0,105430.0,without intervention will never understand meaning cinta life will never know about cinta
12215,16464,16464,17257,644253449517838336,2015-09-16 20:56:06+00:00,https://twitter.com/__Bungs/status/644253449517838336,"Arise, shine, for your light has come, and the glory of the Lord rises upon you. - Isaiah 60:1",0,0,0,,914271535.0,__Bungs,Indonesia,3788.0,1449.0,459936.0,105430.0,arise shine your terang come glory lord rises upon isaiah
12216,16465,16465,17256,644253536998440960,2015-09-16 20:56:27+00:00,https://twitter.com/__Bungs/status/644253536998440960,"He performs wonders that cannot be fathomed, miracles that cannot be counted. - Job 9:10",0,0,0,,914271535.0,__Bungs,Indonesia,3788.0,1449.0,459936.0,105430.0,performs wonders that cannot fathomed miracles that cannot counted
12217,16466,16466,17255,644253622927097857,2015-09-16 20:56:48+00:00,https://twitter.com/__Bungs/status/644253622927097857,The Lord is close to the brokenhearted and saves those who are crushed in spirit. - Psalm 34:18,0,0,0,,914271535.0,__Bungs,Indonesia,3788.0,1449.0,459936.0,105430.0,lord close tapi brokenhearted saves those crushed spirit psalm
12218,16467,16467,17254,644253706792230912,2015-09-16 20:57:08+00:00,https://twitter.com/__Bungs/status/644253706792230912,"Rescue me from the mire, do not let me sink; deliver me from those who hate me, from the deep waters. - Psalm 69:14",0,0,0,,914271535.0,__Bungs,Indonesia,3788.0,1449.0,459936.0,105430.0,rescue from mire sink deliver from those hate from deep waters psalm
12219,16468,16468,17253,644253780716843008,2015-09-16 20:57:25+00:00,https://twitter.com/__Bungs/status/644253780716843008,"Now the Lord is the Spirit, and where the Spirit of the Lord is, there is freedom. - 2 Corinthians 3:17",0,0,0,,914271535.0,__Bungs,Indonesia,3788.0,1449.0,459936.0,105430.0,lord spirit where spirit lord there freedom corinthians
12220,16469,16469,17252,644253869447315456,2015-09-16 20:57:46+00:00,https://twitter.com/__Bungs/status/644253869447315456,"For, “Everyone who calls on the name of the Lord will be saved.” - Romans 10:13",0,0,0,,914271535.0,__Bungs,Indonesia,3788.0,1449.0,459936.0,105430.0,everyone calls name lord will saved romans
12221,16470,16470,17251,644254031355908096,2015-09-16 20:58:25+00:00,https://twitter.com/__Bungs/status/644254031355908096,"Because you are his sons, God sent the Spirit of his Son into our hearts, the Spirit who calls out, “Abba, Father - Galatians 4:6",0,0,0,,914271535.0,__Bungs,Indonesia,3788.0,1449.0,459936.0,105430.0,because sons sent spirit into kami hearts spirit calls abba father galatians
12222,16471,16471,17250,644255663497986050,2015-09-16 21:04:54+00:00,https://twitter.com/__Bungs/status/644255663497986050,"The LORD showed him a piece of wood. He threw it into the water, and the water became sweet. - Exodus 15:25",0,0,0,,914271535.0,__Bungs,Indonesia,3788.0,1449.0,459936.0,105430.0,lord showed piece wood threw into water water became sweet exodus
12223,16472,16472,17249,644255851063054336,2015-09-16 21:05:39+00:00,https://twitter.com/__Bungs/status/644255851063054336,For the word of God is living and active...it judges the thoughts and attitudes of the heart. - Hebrews 4:12,1,0,1,,914271535.0,__Bungs,Indonesia,3788.0,1449.0,459936.0,105430.0,word living active judges thoughts attitudes heart hebrews
12224,16473,16473,17248,644256159327653888,2015-09-16 21:06:52+00:00,https://twitter.com/__Bungs/status/644256159327653888,He will invade many countries and sweep through them like a flood. He will also invade the Beautiful land. - Daniel 11:40-41,0,0,1,,914271535.0,__Bungs,Indonesia,3788.0,1449.0,459936.0,105430.0,will invade many countries sweep through them like flood will also invade beautiful land daniel
12225,16474,16474,17247,644256364420698112,2015-09-16 21:07:41+00:00,https://twitter.com/__Bungs/status/644256364420698112,"Show proper respect to everyone: Love the brotherhood of believers, fear God, honor the king. - 1 Peter 2:17",1,0,1,,914271535.0,__Bungs,Indonesia,3788.0,1449.0,459936.0,105430.0,show proper respect tapi everyone cinta brotherhood believers fear honor king peter
12226,16475,16475,17246,644256594968993792,2015-09-16 21:08:36+00:00,https://twitter.com/__Bungs/status/644256594968993792,"But the king will rejoice in God; all who swear by God's name will praise him, while the mouths of the liars will be silenced - Psalm 63:11",0,0,0,,914271535.0,__Bungs,Indonesia,3788.0,1449.0,459936.0,105430.0,king will rejoice swear name will praise while mouths liars will silenced psalm
12227,16480,16480,17241,644573878627385345,2015-09-17 18:09:22+00:00,https://twitter.com/__Bungs/status/644573878627385345,"When we don't get a miracle in our life, we can still be a miracle for some life",0,0,0,,914271535.0,__Bungs,Indonesia,3788.0,1449.0,459936.0,105430.0,when miracle kami life belum masih miracle some life
12228,16482,16482,17239,644599179537334272,2015-09-17 19:49:55+00:00,https://twitter.com/__Bungs/status/644599179537334272,"A wise servant shall have rule over a son that causeth shame, and shall have part of the inheritance among the brethren. - Proverbs 17:2",0,0,0,,914271535.0,__Bungs,Indonesia,3788.0,1449.0,459936.0,105430.0,wise servant shall have rule over that causeth shame shall have part inheritance among brethren proverbs
12229,16483,16483,17238,644599362916511744,2015-09-17 19:50:38+00:00,https://twitter.com/__Bungs/status/644599362916511744,Sacrifice him there as a burnt offering on one of the mountains I will tell you about. - Genesis 22:2,0,0,0,,914271535.0,__Bungs,Indonesia,3788.0,1449.0,459936.0,105430.0,sacrifice there burnt offering mountains will tell about genesis
12230,16484,16484,17237,644599514750255104,2015-09-17 19:51:15+00:00,https://twitter.com/__Bungs/status/644599514750255104,Let a little water be brought. And then you may all wash your feet and rest under this tree. - Genesis 18:4,0,0,0,,914271535.0,__Bungs,Indonesia,3788.0,1449.0,459936.0,105430.0,little water brought then wash your feet rest under this tree genesis
12231,16485,16485,17236,644599747152637952,2015-09-17 19:52:10+00:00,https://twitter.com/__Bungs/status/644599747152637952,And many people of other nationalities became Jews because fear of the Jews had seized them. - Esther 8:17,0,0,0,,914271535.0,__Bungs,Indonesia,3788.0,1449.0,459936.0,105430.0,many people other nationalities became jews because fear jews seized them esther
12232,16486,16486,17235,644599929038598144,2015-09-17 19:52:53+00:00,https://twitter.com/__Bungs/status/644599929038598144,"My conscience is clear, but that does not make me innocent. It is the Lord who judges me. - 1 Corinthians 4:4",0,0,0,,914271535.0,__Bungs,Indonesia,3788.0,1449.0,459936.0,105430.0,conscience clear that does memakai innocent lord judges corinthians
12233,16487,16487,17234,644600054976679936,2015-09-17 19:53:23+00:00,https://twitter.com/__Bungs/status/644600054976679936,Now it is required that those who have been given a trust must prove faithful - 1 Corinthians 4:2,0,0,0,,914271535.0,__Bungs,Indonesia,3788.0,1449.0,459936.0,105430.0,required that those have been given trust must prove faithful corinthians
12234,16488,16488,17233,644600244160716800,2015-09-17 19:54:08+00:00,https://twitter.com/__Bungs/status/644600244160716800,Woe to those who are wise in their own eyes and clever in their own sight. - Isaiah 5:21,0,0,0,,914271535.0,__Bungs,Indonesia,3788.0,1449.0,459936.0,105430.0,tapi those wise their eyes clever their sight isaiah
12235,16489,16489,17232,644761635156942848,2015-09-18 06:35:27+00:00,https://twitter.com/__Bungs/status/644761635156942848,"But to you who fear my name, The Sun of Righteousness shall arise. With healing in His wings. - Malachi 4:2",0,0,0,,914271535.0,__Bungs,Indonesia,3788.0,1449.0,459936.0,105430.0,tapi fear name righteousness shall arise dengan healing wings malachi
12236,16490,16490,17231,644761773430587392,2015-09-18 06:36:00+00:00,https://twitter.com/__Bungs/status/644761773430587392,Come let us return to the Lord. For He has torn and He will heal us. He has stricken but He will bind us up. - Hosea 6:1,2,0,0,,914271535.0,__Bungs,Indonesia,3788.0,1449.0,459936.0,105430.0,come return tapi lord torn will heal stricken will bind hosea
12237,16491,16491,17230,644761905031049216,2015-09-18 06:36:31+00:00,https://twitter.com/__Bungs/status/644761905031049216,The steadfast love of the Lord never ceases. His mercies never come to an end. - Lamentations 3:18,1,0,0,,914271535.0,__Bungs,Indonesia,3788.0,1449.0,459936.0,105430.0,steadfast cinta lord never ceases mercies never come tapi lamentations
12238,16492,16492,17229,644762208367325184,2015-09-18 06:37:44+00:00,https://twitter.com/__Bungs/status/644762208367325184,Time and chance happen to all. - Ecclesiastes 9:11-12,1,0,0,,914271535.0,__Bungs,Indonesia,3788.0,1449.0,459936.0,105430.0,time chance happen tapi ecclesiastes
12239,16493,16493,17228,644762314571276288,2015-09-18 06:38:09+00:00,https://twitter.com/__Bungs/status/644762314571276288,The spirit will return to God who gave it. - Ecclesiastes 12:7,2,0,0,,914271535.0,__Bungs,Indonesia,3788.0,1449.0,459936.0,105430.0,spirit will return tapi gave ecclesiastes
12240,16494,16494,17227,644762635443924992,2015-09-18 06:39:26+00:00,https://twitter.com/__Bungs/status/644762635443924992,"You will guide me with your counsel, and afterwards receive me to glory. - Psalm 73:24",2,0,0,,914271535.0,__Bungs,Indonesia,3788.0,1449.0,459936.0,105430.0,will guide dengan your counsel afterwards receive tapi glory psalm
12241,16495,16495,17226,644762924326612993,2015-09-18 06:40:34+00:00,https://twitter.com/__Bungs/status/644762924326612993,"Let us come boldly before the Throne of Grace, that we may obtain mercy. - Hebrews 4:16",3,1,1,,914271535.0,__Bungs,Indonesia,3788.0,1449.0,459936.0,105430.0,come boldly before throne grace that obtain mercy hebrews
12242,16496,16496,64802,645045060405334017,2015-09-19 01:21:41+00:00,https://twitter.com/RiverofHealing/status/645045060405334017,@TheLastFranky AMEN!!! All Glory To God...,1,0,0,,207783275.0,RiverofHealing,Illinois,7458.0,6940.0,5673.0,19314.0,amin glory tapi
12243,16497,16497,17225,645124698485882880,2015-09-19 06:38:08+00:00,https://twitter.com/__Bungs/status/645124698485882880,"Throughout the period of their dedication, they are consecrated to the Lord. - Numbers 6:8",0,0,0,,914271535.0,__Bungs,Indonesia,3788.0,1449.0,459936.0,105430.0,throughout period their dedication they consecrated tapi lord numbers
12244,16498,16498,17224,645124857324134400,2015-09-19 06:38:46+00:00,https://twitter.com/__Bungs/status/645124857324134400,"""God is spirit, and his worshipers must worship in the Spirit and in truth.” - John 4:23",0,0,0,,914271535.0,__Bungs,Indonesia,3788.0,1449.0,459936.0,105430.0,spirit worshipers must worship spirit truth john
12245,16499,16499,17223,645125018049843201,2015-09-19 06:39:24+00:00,https://twitter.com/__Bungs/status/645125018049843201,"For even the Son of Man did not come to be served, but to serve, and to give his life as a ransom for many. - Mark 10:45",0,0,0,,914271535.0,__Bungs,Indonesia,3788.0,1449.0,459936.0,105430.0,even come tapi served tapi serve tapi give life ransom many mark
12246,16500,16500,17222,645125113982005249,2015-09-19 06:39:47+00:00,https://twitter.com/__Bungs/status/645125113982005249,May my supplication come before you; deliver me according to your promise. - Psalm 119:170,0,0,0,,914271535.0,__Bungs,Indonesia,3788.0,1449.0,459936.0,105430.0,supplication come before deliver according tapi your promise psalm
12247,16501,16501,17221,645125640438464513,2015-09-19 06:41:53+00:00,https://twitter.com/__Bungs/status/645125640438464513,The Lord is my light and my salvation; whom shall I fear ? The Lord is the strength of my life; of whom shall I be afraid ? - Psalm 27:11,0,0,0,,914271535.0,__Bungs,Indonesia,3788.0,1449.0,459936.0,105430.0,lord terang salvation whom shall fear lord strength life whom shall afraid psalm
12248,16502,16502,17220,645125807002660865,2015-09-19 06:42:32+00:00,https://twitter.com/__Bungs/status/645125807002660865,"The words of the weise are like goads, their collected saying like firmly embedded nails - given by one shepherd. - Ecc. 12:11",0,0,0,,914271535.0,__Bungs,Indonesia,3788.0,1449.0,459936.0,105430.0,words weise like goads their collected saying like firmly embedded nails given shepherd
12249,16503,16503,17219,645125896551010304,2015-09-19 06:42:54+00:00,https://twitter.com/__Bungs/status/645125896551010304,For it is the one who is least among you all who is the greatest. - Luke 9:48,0,0,0,,914271535.0,__Bungs,Indonesia,3788.0,1449.0,459936.0,105430.0,least among greatest luke
12250,16504,16504,17218,645126066831405056,2015-09-19 06:43:34+00:00,https://twitter.com/__Bungs/status/645126066831405056,"But if you remian in me and my words remain in you, you may ask for anything you want, and it will be granted! - John 15:7",0,0,0,,914271535.0,__Bungs,Indonesia,3788.0,1449.0,459936.0,105430.0,remian words remain anything want will granted john
12251,16505,16505,17217,645126211732041728,2015-09-19 06:44:09+00:00,https://twitter.com/__Bungs/status/645126211732041728,But the manifestation of the Spirit is given to each one for the profit of all. - 1 Corinthians 12:7,0,0,0,,914271535.0,__Bungs,Indonesia,3788.0,1449.0,459936.0,105430.0,manifestation spirit given tapi each profit corinthians
12252,16506,16506,17216,645126288705884160,2015-09-19 06:44:27+00:00,https://twitter.com/__Bungs/status/645126288705884160,Therefore let us pursue the things which make for peace and the things by which one may edify another. - Romans 14:19,0,0,0,,914271535.0,__Bungs,Indonesia,3788.0,1449.0,459936.0,105430.0,therefore pursue things which memakai peace things which edify another romans
12253,16507,16507,17215,645126402002456577,2015-09-19 06:44:54+00:00,https://twitter.com/__Bungs/status/645126402002456577,"Love ... bears all things, believes all things, hopes all things, endures all things. - 1 Corinthains 13:7",0,0,0,,914271535.0,__Bungs,Indonesia,3788.0,1449.0,459936.0,105430.0,cinta bears things believes things hopes things endures things corinthains
12254,16508,16508,17214,645126470403162112,2015-09-19 06:45:11+00:00,https://twitter.com/__Bungs/status/645126470403162112,"For all the promises of God in Him are Yes, and in Him Amen, to the glory of God through us. - 2 Corinthians 1:20",0,0,0,,914271535.0,__Bungs,Indonesia,3788.0,1449.0,459936.0,105430.0,promises amin tapi glory through corinthians
12255,16509,16509,17213,645126644743602178,2015-09-19 06:45:52+00:00,https://twitter.com/__Bungs/status/645126644743602178,"But on this one will I look: On him who is poor and of a contrite spirit, And who trembles at My word. - Isaiah 66:2",0,0,0,,914271535.0,__Bungs,Indonesia,3788.0,1449.0,459936.0,105430.0,this will look poor contrite spirit trembles word isaiah
12256,16510,16510,17212,645126764453171200,2015-09-19 06:46:21+00:00,https://twitter.com/__Bungs/status/645126764453171200,It should be that of your inner selfs the unfading beauty of a gentle and quiet spirits which is of great worth in God's sight - 1 Peter 3:4,0,0,0,,914271535.0,__Bungs,Indonesia,3788.0,1449.0,459936.0,105430.0,should that your inner selfs unfading beauty gentle quiet spirits which great worth sight peter
12257,16511,16511,17211,645126898171842561,2015-09-19 06:46:53+00:00,https://twitter.com/__Bungs/status/645126898171842561,The voice of God will never contradict the Word of God. - Numbers 23:19,0,0,0,,914271535.0,__Bungs,Indonesia,3788.0,1449.0,459936.0,105430.0,voice will never contradict word numbers
12258,16512,16512,17210,645127126954283009,2015-09-19 06:47:47+00:00,https://twitter.com/__Bungs/status/645127126954283009,"He isn't here! He is risen from the dead, just as he said would happen. Come, see where his body was lying. - Matthew 28:6",1,0,1,,914271535.0,__Bungs,Indonesia,3788.0,1449.0,459936.0,105430.0,here risen from dead just said would happen come where body lying matthew
12259,16513,16513,17209,645127259607597056,2015-09-19 06:48:19+00:00,https://twitter.com/__Bungs/status/645127259607597056,The work of telling others the Good News about the wonderful grace of God. - Acts 20:24,0,0,0,,914271535.0,__Bungs,Indonesia,3788.0,1449.0,459936.0,105430.0,work telling others bagus news about wonderful grace acts
12260,16514,16514,17208,645127489971335168,2015-09-19 06:49:14+00:00,https://twitter.com/__Bungs/status/645127489971335168,For the word of God is alive and powerful. It is sharper than the sharpest two-edged sword. - Hebrews 4:12,2,1,1,,914271535.0,__Bungs,Indonesia,3788.0,1449.0,459936.0,105430.0,word alive powerful sharper tahan sharpest edged sword hebrews
12261,16515,16515,17207,645127610767245312,2015-09-19 06:49:42+00:00,https://twitter.com/__Bungs/status/645127610767245312,By His wounds you are healed. - 1 Peter 2:24,3,0,1,,914271535.0,__Bungs,Indonesia,3788.0,1449.0,459936.0,105430.0,wounds healed peter
12262,16516,16516,17206,645127683488112640,2015-09-19 06:50:00+00:00,https://twitter.com/__Bungs/status/645127683488112640,And they have defeated him by the blood of the Lamb and by their testimony. - Revelation 12:11,1,0,1,,914271535.0,__Bungs,Indonesia,3788.0,1449.0,459936.0,105430.0,they have defeated blood lamb their testimony revelation
12263,16517,16517,17205,645127737842102272,2015-09-19 06:50:13+00:00,https://twitter.com/__Bungs/status/645127737842102272,Make thankfulness your sacrifice to God. - Psalm 50:14,0,0,1,,914271535.0,__Bungs,Indonesia,3788.0,1449.0,459936.0,105430.0,memakai thankfulness your sacrifice tapi psalm
12264,16523,16523,17200,645485707369144324,2015-09-20 06:32:39+00:00,https://twitter.com/__Bungs/status/645485707369144324,"Happy Sunday everyone in Christ, God Bless http://t.co/XC9JHanUYA",1,0,1,,914271535.0,__Bungs,Indonesia,3788.0,1449.0,459936.0,105430.0,bahagia sunday everyone christ bless
12265,16525,16525,17198,645487492972474368,2015-09-20 06:39:45+00:00,https://twitter.com/__Bungs/status/645487492972474368,It's hard to put in the effort to create greatness but it's a lot harder to accept the reality that you could have been great,0,0,0,,914271535.0,__Bungs,Indonesia,3788.0,1449.0,459936.0,105430.0,hard tapi effort tapi create greatness harder tapi accept reality that could have been great
12266,16526,16526,17197,645495826861522944,2015-09-20 07:12:52+00:00,https://twitter.com/__Bungs/status/645495826861522944,"We only live once but if we do it right, once is enough and don't wait for the perfect moment but make the perfect moment",0,0,0,,914271535.0,__Bungs,Indonesia,3788.0,1449.0,459936.0,105430.0,only live once right once enough wait perfect moment memakai perfect moment
12267,16527,16527,17196,645674878083862528,2015-09-20 19:04:21+00:00,https://twitter.com/__Bungs/status/645674878083862528,I have chosen you out of the world. That is why the world hates you.- John 15:19,1,0,0,,914271535.0,__Bungs,Indonesia,3788.0,1449.0,459936.0,105430.0,have chosen world that world hates john
12268,16528,16528,17195,645675262630215682,2015-09-20 19:05:53+00:00,https://twitter.com/__Bungs/status/645675262630215682,"Besides, she really is my sister, the daughter of my father though not of my mother; and she became my wife. - Genesis 20:12",1,0,0,,914271535.0,__Bungs,Indonesia,3788.0,1449.0,459936.0,105430.0,besides really sister daughter father though mother became wife genesis
12269,16529,16529,17194,645675502326251520,2015-09-20 19:06:50+00:00,https://twitter.com/__Bungs/status/645675502326251520,He who comes after me has surpassed me because he was before me. - John 1:15,2,0,0,,914271535.0,__Bungs,Indonesia,3788.0,1449.0,459936.0,105430.0,comes after surpassed because before john
12270,16530,16530,17193,645675928262017024,2015-09-20 19:08:32+00:00,https://twitter.com/__Bungs/status/645675928262017024,This calls for the patient endurance on the part of the saints who obey God's commandments and remain faithful to Jesus - Revelation 14:12,3,0,1,,914271535.0,__Bungs,Indonesia,3788.0,1449.0,459936.0,105430.0,this calls patient endurance part saints obey commandments remain faithful tapi jesus revelation
12271,16531,16531,17192,645676390621298689,2015-09-20 19:10:22+00:00,https://twitter.com/__Bungs/status/645676390621298689,"“If you are not firm in faith, you will not be firm at all.” - Isaiah 7:9",0,0,0,,914271535.0,__Bungs,Indonesia,3788.0,1449.0,459936.0,105430.0,firm faith will firm isaiah
12272,16532,16532,17191,645676599921111040,2015-09-20 19:11:12+00:00,https://twitter.com/__Bungs/status/645676599921111040,"Nobody should seek his own good, but the good of others. - 1 Corinthians 10:24",0,0,0,,914271535.0,__Bungs,Indonesia,3788.0,1449.0,459936.0,105430.0,nobody should seek bagus bagus others corinthians
12273,16533,16533,17190,645676758398734336,2015-09-20 19:11:49+00:00,https://twitter.com/__Bungs/status/645676758398734336,"If you seek him, he will be found by you, but if you forsake him (or her) he (or she) will forsake you. - 2 Chronicles 15:2",0,0,0,,914271535.0,__Bungs,Indonesia,3788.0,1449.0,459936.0,105430.0,seek will found forsake orang orang will forsake chronicles
12274,16534,16534,17189,645677186993655808,2015-09-20 19:13:32+00:00,https://twitter.com/__Bungs/status/645677186993655808,"Like their fathers they were disloyal and faithless, as unreliable as a faulty bow. - Psalm 78:57",0,0,0,,914271535.0,__Bungs,Indonesia,3788.0,1449.0,459936.0,105430.0,like their fathers they were disloyal faithless unreliable faulty psalm
12275,16535,16535,17188,645677314475323392,2015-09-20 19:14:02+00:00,https://twitter.com/__Bungs/status/645677314475323392,Encourage a rebuke with all authority. Do not let anyone despise you. - Titus 2:15,1,0,0,,914271535.0,__Bungs,Indonesia,3788.0,1449.0,459936.0,105430.0,encourage rebuke dengan authority anyone despise titus
12276,16536,16536,17187,645677445681573888,2015-09-20 19:14:33+00:00,https://twitter.com/__Bungs/status/645677445681573888,You may be sure that such a man is warped and sinful; he is self-condemned. - Titus 3:11,1,0,0,,914271535.0,__Bungs,Indonesia,3788.0,1449.0,459936.0,105430.0,sure that such warped sinful self condemned titus
12277,16537,16537,17186,645677627890495488,2015-09-20 19:15:17+00:00,https://twitter.com/__Bungs/status/645677627890495488,Some who are standing here will not taste death before they see the kingdom of God come with power. - Mark 9:1,1,0,0,,914271535.0,__Bungs,Indonesia,3788.0,1449.0,459936.0,105430.0,some standing here will taste death before they kingdom come dengan power mark
12278,16538,16538,17185,645677777186746369,2015-09-20 19:15:52+00:00,https://twitter.com/__Bungs/status/645677777186746369,If anyone is ashamed of me and my words in this adulterous and sinful generation - Mark 8:38,2,0,1,,914271535.0,__Bungs,Indonesia,3788.0,1449.0,459936.0,105430.0,anyone ashamed words this adulterous sinful generation mark
