,Unnamed: 0.1,Unnamed: 0,index,Id,Tweet Time,Url,Tweet Text,Likes Count,Reply Count,Retweet Count,Retweeted Tweet,User Id,User Name,User Location,User Follower Count,User Following Count,User Likes Count,User Tweets Count,text_clean
12133,16337,16337,17378,642109867675619328,2015-09-10 22:58:16+00:00,https://twitter.com/__Bungs/status/642109867675619328,They do not fear bad news; they confidently trust the LORD to care for them - Psalms 112:7,1,0,0,,914271535.0,__Bungs,Indonesia,3788.0,1449.0,459936.0,105430.0,they fear news they confidently trust lord tapi care them psalms
12134,16338,16338,17377,642110051851743232,2015-09-10 22:59:00+00:00,https://twitter.com/__Bungs/status/642110051851743232,The God of peace will soon crush Satan under your feet. May the grace of our Lord Jesus be with you - Romans 16:20,4,0,2,,914271535.0,__Bungs,Indonesia,3788.0,1449.0,459936.0,105430.0,peace will soon crush satan under your feet grace kami lord jesus dengan romans
12135,16339,16339,17376,642110262594506753,2015-09-10 22:59:51+00:00,https://twitter.com/__Bungs/status/642110262594506753,"The righteous person faces many troubles, but the LORD comes to the rescue each time - Psalms 34:19",4,0,2,,914271535.0,__Bungs,Indonesia,3788.0,1449.0,459936.0,105430.0,righteous person faces many troubles lord comes tapi rescue each time psalms
12136,16340,16340,17375,642110705110413312,2015-09-10 23:01:36+00:00,https://twitter.com/__Bungs/status/642110705110413312,"We thank you, O God! We give thanks because you are near. People everywhere tell of your wonderful deeds - Psalms 75:1",3,0,1,,914271535.0,__Bungs,Indonesia,3788.0,1449.0,459936.0,105430.0,thank give terima kasih because near people everywhere tell your wonderful deeds psalms
12137,16341,16341,17374,642110975714291712,2015-09-10 23:02:41+00:00,https://twitter.com/__Bungs/status/642110975714291712,"So when you, a mere human, pass judgment on them and yet do the same things, do you think you will escape Gods judgment ? - Romans 2:3",3,0,1,,914271535.0,__Bungs,Indonesia,3788.0,1449.0,459936.0,105430.0,when mere human judgment them same things think will escape gods judgment romans
12138,16342,16342,17373,642111246028828674,2015-09-10 23:03:45+00:00,https://twitter.com/__Bungs/status/642111246028828674,"My health may fail, and my spirit may grow weak, but God remains the strength of my heart; he is mine forever - Psalms 73:26",3,0,2,,914271535.0,__Bungs,Indonesia,3788.0,1449.0,459936.0,105430.0,health fail spirit grow weak remains strength heart mine forever psalms
12139,16349,16349,64808,642367386071531520,2015-09-11 16:01:34+00:00,https://twitter.com/traciewmiles/status/642367386071531520,"@TheLastFranky thanks for sharing Fяanky, have a great Friday :) (insight by http://t.co/3jiy8kxQb8)",1,1,0,,26827202.0,traciewmiles,"Charlotte, NC",9765.0,455.0,942.0,4126.0,terima kasih sharing anky have great friday insight
12140,16350,16350,17366,642376126954733568,2015-09-11 16:36:18+00:00,https://twitter.com/__Bungs/status/642376126954733568,"Hear, O Israel: Yahweh is our God. Yahweh is one - Deuteronomy 6:4",0,0,0,,914271535.0,__Bungs,Indonesia,3788.0,1449.0,459936.0,105430.0,hear israel yahweh kami yahweh deuteronomy
12141,16351,16351,17365,642376321050390528,2015-09-11 16:37:04+00:00,https://twitter.com/__Bungs/status/642376321050390528,Cast your burden upon the LORD and He will sustain you; He will never allow the righteous to be shaken. - Psalm 55:22,1,0,0,,914271535.0,__Bungs,Indonesia,3788.0,1449.0,459936.0,105430.0,cast your burden upon lord will sustain will never allow righteous tapi shaken psalm
12142,16352,16352,17364,642376431402528769,2015-09-11 16:37:30+00:00,https://twitter.com/__Bungs/status/642376431402528769,Understand what the Lord wants - Ephesians 5:17,1,0,0,,914271535.0,__Bungs,Indonesia,3788.0,1449.0,459936.0,105430.0,understand what lord wants ephesians
12143,16353,16353,17363,642376544380321792,2015-09-11 16:37:57+00:00,https://twitter.com/__Bungs/status/642376544380321792,Strive for peace with everyone. And strive for the holiness without which no one will see the Lord - Hebrews 12:14,0,0,0,,914271535.0,__Bungs,Indonesia,3788.0,1449.0,459936.0,105430.0,strive peace dengan everyone strive holiness without which nomor will lord hebrews
12144,16354,16354,17362,642376770033872896,2015-09-11 16:38:51+00:00,https://twitter.com/__Bungs/status/642376770033872896,"If your enemy is hungry, give him bread to eat; and if he is thirsty, give him water to drink - Proverbs 25:21",0,0,0,,914271535.0,__Bungs,Indonesia,3788.0,1449.0,459936.0,105430.0,your enemy hungry give bread tapi thirsty give water tapi drink proverbs
12145,16355,16355,17361,642377396658679809,2015-09-11 16:41:20+00:00,https://twitter.com/__Bungs/status/642377396658679809,"I am filled with encouragement and overflowing with joy, despite all our troubles - 2 Corinthians 7:4",1,0,0,,914271535.0,__Bungs,Indonesia,3788.0,1449.0,459936.0,105430.0,sama filled dengan encouragement overflowing dengan despite kami troubles corinthians
12146,16356,16356,17360,642377829443768320,2015-09-11 16:43:03+00:00,https://twitter.com/__Bungs/status/642377829443768320,People should always pray and not give up - Luke 18:1,1,0,0,,914271535.0,__Bungs,Indonesia,3788.0,1449.0,459936.0,105430.0,people should always pray give luke
12147,16357,16357,17359,642377900205871104,2015-09-11 16:43:20+00:00,https://twitter.com/__Bungs/status/642377900205871104,We have peace with God through our Lord Jesus Christ - Romans 5:1,1,0,0,,914271535.0,__Bungs,Indonesia,3788.0,1449.0,459936.0,105430.0,have peace dengan through kami lord jesus christ romans
12148,16358,16358,17358,642378155165024256,2015-09-11 16:44:21+00:00,https://twitter.com/__Bungs/status/642378155165024256,"Surely he has taken our grief and carried our sorrows. Yet we esteemed him stricken, struck by God - Isaiah 53:4",1,0,0,,914271535.0,__Bungs,Indonesia,3788.0,1449.0,459936.0,105430.0,surely taken kami grief carried kami sorrows esteemed stricken struck isaiah
12149,16359,16359,17357,642378331439001600,2015-09-11 16:45:03+00:00,https://twitter.com/__Bungs/status/642378331439001600,God is trustworthy. He won't let you be pressured above your ability - 1 Corinthians 10:13,1,0,0,,914271535.0,__Bungs,Indonesia,3788.0,1449.0,459936.0,105430.0,trustworthy pressured above your ability corinthians
12150,16360,16360,17356,642378569730031616,2015-09-11 16:46:00+00:00,https://twitter.com/__Bungs/status/642378569730031616,My soul finds rest in God alone because my confidence comes from him - Psalm 62:5,1,0,0,,914271535.0,__Bungs,Indonesia,3788.0,1449.0,459936.0,105430.0,soul finds rest alone because confidence comes from psalm
12151,16361,16361,17355,642378753172090880,2015-09-11 16:46:44+00:00,https://twitter.com/__Bungs/status/642378753172090880,There'll be trouble and distress for all who do evil - Romans 2:9,1,0,0,,914271535.0,__Bungs,Indonesia,3788.0,1449.0,459936.0,105430.0,there trouble distress evil romans
12152,16362,16362,17354,642378878393020416,2015-09-11 16:47:14+00:00,https://twitter.com/__Bungs/status/642378878393020416,"God can give you all gifts in abundance, so that at all times you have all you need plus an abundance for all good deeds - 2 Corinthians 9:8",1,0,0,,914271535.0,__Bungs,Indonesia,3788.0,1449.0,459936.0,105430.0,belum give gifts abundance that times have need plus abundance bagus deeds corinthians
12153,16363,16363,17353,642379095590830081,2015-09-11 16:48:05+00:00,https://twitter.com/__Bungs/status/642379095590830081,All we like sheep have gone astray. We have turned everyone to his own way - Isaiah 53:6,1,0,0,,914271535.0,__Bungs,Indonesia,3788.0,1449.0,459936.0,105430.0,like sheep have gone astray have turned everyone tapi isaiah
12154,16364,16364,17352,642379471421505536,2015-09-11 16:49:35+00:00,https://twitter.com/__Bungs/status/642379471421505536,"Say whatever words you're given at that moment. It won't be you speaking, but the Holy Spirit - Mark 13:11",1,0,0,,914271535.0,__Bungs,Indonesia,3788.0,1449.0,459936.0,105430.0,sayang whatever words reply given that moment speaking holy spirit mark
12155,16365,16365,17351,642379944136278016,2015-09-11 16:51:28+00:00,https://twitter.com/__Bungs/status/642379944136278016,Be encouraged. Think the same. Live in peace - and the God of love and peace will be with you - 2 Corinthians 13:11,1,0,0,,914271535.0,__Bungs,Indonesia,3788.0,1449.0,459936.0,105430.0,encouraged think same live peace cinta peace will dengan corinthians
12156,16366,16366,17350,642380092962803712,2015-09-11 16:52:03+00:00,https://twitter.com/__Bungs/status/642380092962803712,Be devoted to prayer. Be alert and joyfully thankful in prayer - Colossians 4:2,1,0,0,,914271535.0,__Bungs,Indonesia,3788.0,1449.0,459936.0,105430.0,devoted tapi prayer alert joyfully thankful prayer colossians
12157,16367,16367,17349,642380190497148928,2015-09-11 16:52:26+00:00,https://twitter.com/__Bungs/status/642380190497148928,The Lord loves justice and will not abandon his loyal people for very long. They will be protected - Psalm 37:28,1,0,0,,914271535.0,__Bungs,Indonesia,3788.0,1449.0,459936.0,105430.0,lord loves justice will abandon loyal people very long they will protected psalm
12158,16368,16368,17348,642380287049990144,2015-09-11 16:52:49+00:00,https://twitter.com/__Bungs/status/642380287049990144,Like someone comforted by his mother. so will I comfort you - Isaiah 66:13,2,0,3,,914271535.0,__Bungs,Indonesia,3788.0,1449.0,459936.0,105430.0,like someone comforted mother will comfort isaiah
12159,16369,16369,17347,642380377466605568,2015-09-11 16:53:11+00:00,https://twitter.com/__Bungs/status/642380377466605568,God is spirit. And those who worship him must worship in spirit and in truth - John 4:24,3,0,4,,914271535.0,__Bungs,Indonesia,3788.0,1449.0,459936.0,105430.0,spirit those worship must worship spirit truth john
12160,16370,16370,17346,642380695927570432,2015-09-11 16:54:27+00:00,https://twitter.com/__Bungs/status/642380695927570432,"Jesus is worthy to receive power, wealth, wisdom, strength, honor, glory, and praise - Revelation 5:12",2,0,5,,914271535.0,__Bungs,Indonesia,3788.0,1449.0,459936.0,105430.0,jesus worthy tapi receive power wealth wisdom strength honor glory praise revelation
12161,16371,16371,17345,642380935732695040,2015-09-11 16:55:24+00:00,https://twitter.com/__Bungs/status/642380935732695040,How great are God's miracles. How powerful are his marvels - Daniel 4:3,2,0,4,,914271535.0,__Bungs,Indonesia,3788.0,1449.0,459936.0,105430.0,great miracles powerful marvels daniel
12162,16372,16372,17344,642381070629867520,2015-09-11 16:55:56+00:00,https://twitter.com/__Bungs/status/642381070629867520,Pray for one another - James 5:16,2,0,5,,914271535.0,__Bungs,Indonesia,3788.0,1449.0,459936.0,105430.0,pray another james
12163,16373,16373,17343,642381153500925952,2015-09-11 16:56:16+00:00,https://twitter.com/__Bungs/status/642381153500925952,The Lord lives! - Psalm 18:46,2,0,2,,914271535.0,__Bungs,Indonesia,3788.0,1449.0,459936.0,105430.0,lord lives psalm
12164,16374,16374,17342,642381242516684800,2015-09-11 16:56:37+00:00,https://twitter.com/__Bungs/status/642381242516684800,"Worldly desires are against the Spirit, and the Spirit is against worldly desires - Galatians 5:17",2,0,2,,914271535.0,__Bungs,Indonesia,3788.0,1449.0,459936.0,105430.0,worldly desires against spirit spirit against worldly desires galatians
12165,16376,16376,17340,642632140698464256,2015-09-12 09:33:36+00:00,https://twitter.com/__Bungs/status/642632140698464256,"Always give thanks to God , what He gives , be as bright as the love of God http://t.co/AIlhjipcfm",5,1,7,,914271535.0,__Bungs,Indonesia,3788.0,1449.0,459936.0,105430.0,always give terima kasih tapi what gives bright cinta
12166,16383,16383,64807,642791896436330496,2015-09-12 20:08:25+00:00,https://twitter.com/SteadmanDeb/status/642791896436330496,@TheLastFranky @Evadam7 Amen Amen Amen,1,0,0,,3323594787.0,SteadmanDeb,"Spartanburg, SC",1024.0,712.0,155.0,6360.0,amin amin amin
12167,16384,16384,17333,642798316305055744,2015-09-12 20:33:55+00:00,https://twitter.com/__Bungs/status/642798316305055744,"God always gives the best for us , as always put hope in Him , God will open the way",0,0,0,,914271535.0,__Bungs,Indonesia,3788.0,1449.0,459936.0,105430.0,always gives best always hope will open
12168,16385,16385,17332,642799295893114880,2015-09-12 20:37:49+00:00,https://twitter.com/__Bungs/status/642799295893114880,Faith will not change anything if we do not ever believe and understand the meaning and purpose of God,0,0,0,,914271535.0,__Bungs,Indonesia,3788.0,1449.0,459936.0,105430.0,faith will change anything ever believe understand meaning purpose
12169,16395,16395,17322,643027258442039297,2015-09-13 11:43:39+00:00,https://twitter.com/__Bungs/status/643027258442039297,"Happy sunday to everyone in Christ , God Bless http://t.co/XlW8vGZDHE",2,0,1,,914271535.0,__Bungs,Indonesia,3788.0,1449.0,459936.0,105430.0,bahagia sunday tapi everyone christ bless
12170,16400,16400,17317,643442629238108160,2015-09-14 15:14:12+00:00,https://twitter.com/__Bungs/status/643442629238108160,"If we pray and share with each person , God will protect us from any",0,0,0,,914271535.0,__Bungs,Indonesia,3788.0,1449.0,459936.0,105430.0,pray share dengan each person will protect from
12171,16401,16401,17316,643443844248285184,2015-09-14 15:19:01+00:00,https://twitter.com/__Bungs/status/643443844248285184,"Remain grateful thanks to God , He does not live for one person , still share with God's Love to others",0,0,0,,914271535.0,__Bungs,Indonesia,3788.0,1449.0,459936.0,105430.0,remain grateful terima kasih tapi does live person masih share dengan cinta tapi others
12172,16402,16402,17315,643445632196173824,2015-09-14 15:26:08+00:00,https://twitter.com/__Bungs/status/643445632196173824,"Jesus replied: ""Love the Lord your God with all your heart and with all your soul and with all your mind."" - Matthew 22:37",0,0,0,,914271535.0,__Bungs,Indonesia,3788.0,1449.0,459936.0,105430.0,jesus replied cinta lord your dengan your heart dengan your soul dengan your mind matthew
12173,16403,16403,17314,643445756171448321,2015-09-14 15:26:37+00:00,https://twitter.com/__Bungs/status/643445756171448321,Be a blessing to someone today - Proverbs 11:25,0,0,0,,914271535.0,__Bungs,Indonesia,3788.0,1449.0,459936.0,105430.0,blessing tapi someone today proverbs
12174,16404,16404,17313,643446469458923520,2015-09-14 15:29:27+00:00,https://twitter.com/__Bungs/status/643446469458923520,Always give joyful thanks for all things to God - Ephesians 5:20,3,1,1,,914271535.0,__Bungs,Indonesia,3788.0,1449.0,459936.0,105430.0,always give joyful terima kasih things tapi ephesians
12175,16405,16405,17312,643446800234352640,2015-09-14 15:30:46+00:00,https://twitter.com/__Bungs/status/643446800234352640,The Lord is great and should be abundantly praised. His greatness has no limit - Psalm 145:3,1,0,1,,914271535.0,__Bungs,Indonesia,3788.0,1449.0,459936.0,105430.0,lord great should abundantly praised greatness nomor limit psalm
12176,16406,16406,17311,643446937224478720,2015-09-14 15:31:19+00:00,https://twitter.com/__Bungs/status/643446937224478720,"I will uplift you, my God the King. I will bless your name for a long, long time - Psalm 145:1",4,0,2,,914271535.0,__Bungs,Indonesia,3788.0,1449.0,459936.0,105430.0,will uplift king will bless your name long long time psalm
12177,16407,16407,64806,643447321586438144,2015-09-14 15:32:50+00:00,https://twitter.com/sorto_sherry/status/643447321586438144,@TheLastFranky Amen Amen Brother in Christ Jesus always,1,0,0,,3307111479.0,sorto_sherry,"North Carolina, USA",2369.0,1725.0,11140.0,9944.0,amin amin brother christ jesus always
12178,16408,16408,17310,643447407301169153,2015-09-14 15:33:11+00:00,https://twitter.com/__Bungs/status/643447407301169153,I leave you peace. I give you my own peace. But I don’t give it to you like the world gives it - John 14:27,2,0,0,,914271535.0,__Bungs,Indonesia,3788.0,1449.0,459936.0,105430.0,leave peace give peace give tapi like world gives john
12179,16409,16409,17309,643447604928380928,2015-09-14 15:33:58+00:00,https://twitter.com/__Bungs/status/643447604928380928,"Make sure that nobody pays back wrong for wrong, but always try to be kind to each other and to everyone else. - 1 Thessalonians 5:15",3,0,1,,914271535.0,__Bungs,Indonesia,3788.0,1449.0,459936.0,105430.0,memakai sure that nobody pays back wrong wrong always tapi kind tapi each other tapi everyone else thessalonians
12180,16410,16410,17308,643447772369154048,2015-09-14 15:34:38+00:00,https://twitter.com/__Bungs/status/643447772369154048,"God, disgrace and confuse those who seek my life. Turn back and dishonour those who want evil for me - Psalm 70:2",3,0,2,,914271535.0,__Bungs,Indonesia,3788.0,1449.0,459936.0,105430.0,disgrace confuse those seek life turn back dishonour those want evil psalm
12181,16411,16411,17307,643448067732078592,2015-09-14 15:35:48+00:00,https://twitter.com/__Bungs/status/643448067732078592,Make them holy by the truth; God's word is truth - John 17:17,1,1,2,,914271535.0,__Bungs,Indonesia,3788.0,1449.0,459936.0,105430.0,memakai them holy truth word truth john
12182,16412,16412,17306,643448295671463936,2015-09-14 15:36:43+00:00,https://twitter.com/__Bungs/status/643448295671463936,"Those who want to come after me should deny self, lift up their cross, and follow me - Matthew 16:24",3,0,2,,914271535.0,__Bungs,Indonesia,3788.0,1449.0,459936.0,105430.0,those want tapi come after should deny self lift their cross follow matthew
12183,16413,16413,17305,643448427523608576,2015-09-14 15:37:14+00:00,https://twitter.com/__Bungs/status/643448427523608576,Obey the message; don’t just listen to it and thus delude yourselves - James 1:22,3,0,1,,914271535.0,__Bungs,Indonesia,3788.0,1449.0,459936.0,105430.0,obey message just listen tapi thus delude yourselves james
12184,16414,16414,17304,643448510147203073,2015-09-14 15:37:34+00:00,https://twitter.com/__Bungs/status/643448510147203073,Come close to God and he will come close to you -- James 4:8,1,0,0,,914271535.0,__Bungs,Indonesia,3788.0,1449.0,459936.0,105430.0,come close tapi will come close tapi james
12185,16415,16415,17303,643448671040761856,2015-09-14 15:38:12+00:00,https://twitter.com/__Bungs/status/643448671040761856,We have become partners of Christ if we hold our original purpose unshaken until the end -- Hebrews 3:14,3,0,0,,914271535.0,__Bungs,Indonesia,3788.0,1449.0,459936.0,105430.0,have become partners christ hold kami original purpose unshaken until hebrews
12186,16416,16416,17302,643448935768391680,2015-09-14 15:39:15+00:00,https://twitter.com/__Bungs/status/643448935768391680,"I lift my thoughts to you, Lord. I trust you, my God - Psalm 25:1-2",2,0,0,,914271535.0,__Bungs,Indonesia,3788.0,1449.0,459936.0,105430.0,lift thoughts tapi lord trust psalm
12187,16417,16417,17301,643449011878236160,2015-09-14 15:39:33+00:00,https://twitter.com/__Bungs/status/643449011878236160,Pray that you’ll have the upper hand - Luke 21:36,1,0,0,,914271535.0,__Bungs,Indonesia,3788.0,1449.0,459936.0,105430.0,pray that have upper hand luke
12188,16418,16418,17300,643449192979914753,2015-09-14 15:40:16+00:00,https://twitter.com/__Bungs/status/643449192979914753,"Don’t rejoice against me, O my enemy, for when I fall, I shall arise - Micah 7:8",1,0,1,,914271535.0,__Bungs,Indonesia,3788.0,1449.0,459936.0,105430.0,rejoice against enemy when fall shall arise micah
12189,16419,16419,17299,643449373943160832,2015-09-14 15:41:00+00:00,https://twitter.com/__Bungs/status/643449373943160832,Serve one another in love - Galatians 5:13,2,0,1,,914271535.0,__Bungs,Indonesia,3788.0,1449.0,459936.0,105430.0,serve another cinta galatians
12190,16420,16420,17298,643449728026329088,2015-09-14 15:42:24+00:00,https://twitter.com/__Bungs/status/643449728026329088,"Jesus said about the Second Coming, “Stay alert because you don’t know when the time will come” -- Mark 13:33",3,0,2,,914271535.0,__Bungs,Indonesia,3788.0,1449.0,459936.0,105430.0,jesus said about second coming stay alert because know when time will come mark
12191,16421,16421,17297,643449818103181312,2015-09-14 15:42:46+00:00,https://twitter.com/__Bungs/status/643449818103181312,Have faith in God - Mark 11:22,3,0,1,,914271535.0,__Bungs,Indonesia,3788.0,1449.0,459936.0,105430.0,have faith mark
12192,16422,16422,17296,643449926551105540,2015-09-14 15:43:11+00:00,https://twitter.com/__Bungs/status/643449926551105540,God will make a way out so you can endure pressure - 1 Corinthians 10:13,5,0,1,,914271535.0,__Bungs,Indonesia,3788.0,1449.0,459936.0,105430.0,will memakai belum endure pressure corinthians
12193,16423,16423,17295,643491595766099968,2015-09-14 18:28:46+00:00,https://twitter.com/__Bungs/status/643491595766099968,"He is dressed in a robe dipped in blood, and his name is the Word of God. - Revelation 19:13",2,1,1,,914271535.0,__Bungs,Indonesia,3788.0,1449.0,459936.0,105430.0,dressed robe dipped blood name word revelation
12194,16424,16424,17294,643491686853832704,2015-09-14 18:29:08+00:00,https://twitter.com/__Bungs/status/643491686853832704,"His eyes are like blazing fire, and on his head are many crowns. - Revelation 19:12",2,0,1,,914271535.0,__Bungs,Indonesia,3788.0,1449.0,459936.0,105430.0,eyes like blazing fire head many crowns revelation
12195,16425,16425,17293,643491848430985217,2015-09-14 18:29:46+00:00,https://twitter.com/__Bungs/status/643491848430985217,"For the great day of their wrath has come, and who can stand ? - Revelation 6:17",2,0,1,,914271535.0,__Bungs,Indonesia,3788.0,1449.0,459936.0,105430.0,great their wrath come belum stand revelation
12196,16426,16426,17292,643491995491672064,2015-09-14 18:30:21+00:00,https://twitter.com/__Bungs/status/643491995491672064,"""How long, Sovereign Lord, holy and true, until you judge the inhabitants of the earth and avenge our blood ?"" - Revelation 610",2,0,1,,914271535.0,__Bungs,Indonesia,3788.0,1449.0,459936.0,105430.0,long sovereign lord holy true until judge inhabitants earth avenge kami blood revelation
12197,16428,16428,17291,643492153046528000,2015-09-14 18:30:59+00:00,https://twitter.com/__Bungs/status/643492153046528000,"Worthy is the Lamb, who was slain, to receive power and wealth and wisdom and strength and honor and glory and praise! - Revelation 5:12",3,1,2,,914271535.0,__Bungs,Indonesia,3788.0,1449.0,459936.0,105430.0,worthy lamb slain tapi receive power wealth wisdom strength honor glory praise revelation
12198,16429,16429,17290,643492223225589760,2015-09-14 18:31:16+00:00,https://twitter.com/__Bungs/status/643492223225589760,"You have made them to be a kingdom and priests to serve our God, and they will reign on the earth. - Revelation 5:10",2,0,1,,914271535.0,__Bungs,Indonesia,3788.0,1449.0,459936.0,105430.0,have made them tapi kingdom priests tapi serve kami they will reign earth revelation
12199,16430,16430,17289,643492337033854978,2015-09-14 18:31:43+00:00,https://twitter.com/__Bungs/status/643492337033854978,"Before the throne, seven lamps were blazing. These are the seven spirits of God. - Revelation 4:5",2,0,1,,914271535.0,__Bungs,Indonesia,3788.0,1449.0,459936.0,105430.0,before throne seven lamps were blazing these seven spirits revelation
12200,16431,16431,17288,643492451756457985,2015-09-14 18:32:10+00:00,https://twitter.com/__Bungs/status/643492451756457985,After this I looked and there before me was a door standing open in heaven. - Revelation 4:1,4,0,1,,914271535.0,__Bungs,Indonesia,3788.0,1449.0,459936.0,105430.0,after this looked there before door standing open heaven revelation
12201,16432,16432,17287,643492575446454273,2015-09-14 18:32:40+00:00,https://twitter.com/__Bungs/status/643492575446454273,"He who has an ear, let him hear what the Spirit says to the churches. - Revelation 3:22",3,0,1,,914271535.0,__Bungs,Indonesia,3788.0,1449.0,459936.0,105430.0,hear what spirit says tapi churches revelation
12202,16433,16433,17286,643492754610384896,2015-09-14 18:33:22+00:00,https://twitter.com/__Bungs/status/643492754610384896,"If anyone will not welcome you or listen to your words, shake the dust off your feet when you leave that home or town. - Matthew 10:14",2,0,1,,914271535.0,__Bungs,Indonesia,3788.0,1449.0,459936.0,105430.0,anyone will welcome orang listen tapi your words shake dust your feet when leave that home orang town matthew
12203,16434,16434,17285,643492851129688064,2015-09-14 18:33:45+00:00,https://twitter.com/__Bungs/status/643492851129688064,"If we claim to have fellowship with him yet walk in the darkness, we lie and do not live by the truth. - 1 John 1:6",2,0,1,,914271535.0,__Bungs,Indonesia,3788.0,1449.0,459936.0,105430.0,claim tapi have fellowship dengan walk darkness live truth john
12204,16435,16435,17284,643493003802357760,2015-09-14 18:34:22+00:00,https://twitter.com/__Bungs/status/643493003802357760,"To him who overcomes, I will give the right to eat from the tree of life, which is in the paradise of God.-  Revelation 2:7",2,0,1,,914271535.0,__Bungs,Indonesia,3788.0,1449.0,459936.0,105430.0,tapi overcomes will give right tapi from tree life which paradise revelation
12205,16436,16436,17283,643493130130563072,2015-09-14 18:34:52+00:00,https://twitter.com/__Bungs/status/643493130130563072,"But women will be saved through childbearing--if they continue in faith, love and holiness with propriety. - 1 Timothy 2:15",1,0,0,,914271535.0,__Bungs,Indonesia,3788.0,1449.0,459936.0,105430.0,women will saved through childbearing they continue faith cinta holiness dengan propriety timothy
12206,16437,16437,17282,643493207565815809,2015-09-14 18:35:10+00:00,https://twitter.com/__Bungs/status/643493207565815809,A woman should learn in quietness and full submission. - 1 Timothy 2:11,1,0,0,,914271535.0,__Bungs,Indonesia,3788.0,1449.0,459936.0,105430.0,woman should learn quietness full submission timothy
