,Unnamed: 0.1,Unnamed: 0,index,Id,Tweet Time,Url,Tweet Text,Likes Count,Reply Count,Retweet Count,Retweeted Tweet,User Id,User Name,User Location,User Follower Count,User Following Count,User Likes Count,User Tweets Count,text_clean
7707,10537,10537,22491,568714424803921920,2015-02-20 10:10:59+00:00,https://twitter.com/__Bungs/status/568714424803921920,"Judge nothing before the time, before the Lord comes - 1 Corinthians 4:5",0,0,0,,914271535.0,__Bungs,Indonesia,3788.0,1449.0,459936.0,105430.0,judge nothing before time before lord comes corinthians
7708,10538,10538,22490,568714535768424448,2015-02-20 10:11:26+00:00,https://twitter.com/__Bungs/status/568714535768424448,All of us will answer to God - Romans 14:12,0,0,0,,914271535.0,__Bungs,Indonesia,3788.0,1449.0,459936.0,105430.0,will answer tapi romans
7709,10539,10539,22489,568714756317511680,2015-02-20 10:12:18+00:00,https://twitter.com/__Bungs/status/568714756317511680,So why do you criticize others? Or why do you despise others? For we will all stand before God’s judgment seat—Romans 14:10,0,0,0,,914271535.0,__Bungs,Indonesia,3788.0,1449.0,459936.0,105430.0,criticize others orang despise others will stand before judgment seat romans
7710,10540,10540,22488,568715074224787456,2015-02-20 10:13:34+00:00,https://twitter.com/__Bungs/status/568715074224787456,Don’t complain about one another so that you may not be judged. The Judge is standing at the door! - James 5:9,0,0,0,,914271535.0,__Bungs,Indonesia,3788.0,1449.0,459936.0,105430.0,complain about another that judged judge standing door james
7711,10541,10541,22487,568715206097899523,2015-02-20 10:14:06+00:00,https://twitter.com/__Bungs/status/568715206097899523,"If we love one another, God remains in us and his love in us is made complete - 1 John 4:12",0,0,0,,914271535.0,__Bungs,Indonesia,3788.0,1449.0,459936.0,105430.0,cinta another remains cinta made complete john
7712,10542,10542,22486,568715345285902336,2015-02-20 10:14:39+00:00,https://twitter.com/__Bungs/status/568715345285902336,The Son of man’s coming will be like the days of Noah - Matthew 24:37,0,0,0,,914271535.0,__Bungs,Indonesia,3788.0,1449.0,459936.0,105430.0,coming will like days noah matthew
7713,10543,10543,22485,568715475376431104,2015-02-20 10:15:10+00:00,https://twitter.com/__Bungs/status/568715475376431104,You are great and do marvelous things. You alone are God - Psalm 86:10,0,0,0,,914271535.0,__Bungs,Indonesia,3788.0,1449.0,459936.0,105430.0,great marvelous things alone psalm
7714,10544,10544,22484,568715598269587456,2015-02-20 10:15:39+00:00,https://twitter.com/__Bungs/status/568715598269587456,Those who’ve done good will rise to have life. Those who’ve committed evil will rise to face judgment - John 5:29,0,0,0,,914271535.0,__Bungs,Indonesia,3788.0,1449.0,459936.0,105430.0,those done bagus will rise tapi have life those committed evil will rise tapi face judgment john
7715,10545,10545,22483,568715851806801921,2015-02-20 10:16:39+00:00,https://twitter.com/__Bungs/status/568715851806801921,"Lord my God, I take refuge in you. Save me and rescue me from all who pursue me - Psalm 7:1",0,0,0,,914271535.0,__Bungs,Indonesia,3788.0,1449.0,459936.0,105430.0,lord take refuge save rescue from pursue psalm
7716,10546,10546,22482,568715956098240513,2015-02-20 10:17:04+00:00,https://twitter.com/__Bungs/status/568715956098240513,The Spirit clearly says that in later times some will leave the faith - 1 Timothy 4:1,0,0,0,,914271535.0,__Bungs,Indonesia,3788.0,1449.0,459936.0,105430.0,spirit clearly says that later times some will leave faith timothy
7717,10547,10547,22481,568716143625576448,2015-02-20 10:17:49+00:00,https://twitter.com/__Bungs/status/568716143625576448,Ten thousand times ten thousand stood before him. The judgment sat and books were opened - Daniel 7:10,0,0,0,,914271535.0,__Bungs,Indonesia,3788.0,1449.0,459936.0,105430.0,thousand times thousand stood before judgment books were opened daniel
7718,10548,10548,22480,568716283451019264,2015-02-20 10:18:22+00:00,https://twitter.com/__Bungs/status/568716283451019264,"You’ll sit on thrones, judging Israel’s twelve tribes - Luke 22:30",0,0,0,,914271535.0,__Bungs,Indonesia,3788.0,1449.0,459936.0,105430.0,thrones judging israel twelve tribes luke
7719,10549,10549,22479,568716401831051265,2015-02-20 10:18:51+00:00,https://twitter.com/__Bungs/status/568716401831051265,"In the time of the end, many will go to and fro and knowledge will increase - Daniel 12:4",0,0,0,,914271535.0,__Bungs,Indonesia,3788.0,1449.0,459936.0,105430.0,time many will tapi knowledge will increase daniel
7720,10550,10550,22478,568716606932525056,2015-02-20 10:19:39+00:00,https://twitter.com/__Bungs/status/568716606932525056,"How long, Lord, will you keep ignoring me? How long will you hide your face from me? - Psalm 13:1",0,0,0,,914271535.0,__Bungs,Indonesia,3788.0,1449.0,459936.0,105430.0,long lord will keep ignoring long will hide your face from psalm
7721,10551,10551,22477,568716889788035072,2015-02-20 10:20:47+00:00,https://twitter.com/__Bungs/status/568716889788035072,"In later times some will...forbid marriage and abstain from foods - 1 Timothy 4:1, 3",0,0,0,,914271535.0,__Bungs,Indonesia,3788.0,1449.0,459936.0,105430.0,later times some will forbid marriage abstain from foods timothy
7722,10552,10552,22476,568717023837949952,2015-02-20 10:21:19+00:00,https://twitter.com/__Bungs/status/568717023837949952,"Jesus said, ""I will give those who overcome the right to eat from the life-giving tree which is in God’s garden"" - Revelation 2:7",0,0,0,,914271535.0,__Bungs,Indonesia,3788.0,1449.0,459936.0,105430.0,jesus said will give those overcome right tapi from life giving tree which garden revelation
7723,10553,10553,22475,568717223163863040,2015-02-20 10:22:06+00:00,https://twitter.com/__Bungs/status/568717223163863040,Keep yourselves in God’s love while waiting for the kindness of our Lord Jesus Christ to bring you eternal life—Jude 21,0,0,0,,914271535.0,__Bungs,Indonesia,3788.0,1449.0,459936.0,105430.0,keep yourselves cinta while waiting kindness kami lord jesus christ tapi bring eternal life jude
7724,10554,10554,22474,568717350314188800,2015-02-20 10:22:37+00:00,https://twitter.com/__Bungs/status/568717350314188800,We must all appear before Christ’s judgment seat. –to each receive the result of the good or bad which we have done - 2 Corinthians 5:10,1,1,0,,914271535.0,__Bungs,Indonesia,3788.0,1449.0,459936.0,105430.0,must appear before christ judgment seat tapi each receive result bagus orang which have done corinthians
7725,10555,10555,22473,568717578777944064,2015-02-20 10:23:31+00:00,https://twitter.com/__Bungs/status/568717578777944064,"Jesus said, ""Those who have my commandments and keep them are the ones who love me"" - John 14:21",1,0,0,,914271535.0,__Bungs,Indonesia,3788.0,1449.0,459936.0,105430.0,jesus said those have commandments keep them ones cinta john
7726,10557,10557,22472,568718334444720128,2015-02-20 10:26:31+00:00,https://twitter.com/__Bungs/status/568718334444720128,God chose us... to be holy and without fault - Ephesians 1:4,1,0,0,,914271535.0,__Bungs,Indonesia,3788.0,1449.0,459936.0,105430.0,chose tapi holy without fault ephesians
7727,10558,10558,22471,568718518012616704,2015-02-20 10:27:15+00:00,https://twitter.com/__Bungs/status/568718518012616704,A man’s pride shall bring him low: but honor shall uphold the humble in spirit. -Proverbs 29:23,0,0,0,,914271535.0,__Bungs,Indonesia,3788.0,1449.0,459936.0,105430.0,pride shall bring kalau honor shall uphold humble spirit proverbs
7728,10559,10559,22470,568718660702830592,2015-02-20 10:27:49+00:00,https://twitter.com/__Bungs/status/568718660702830592,"When God made a promise to Abraham, he swore by himself for he had no one greater to swear by - Hebrews 6:13",0,0,0,,914271535.0,__Bungs,Indonesia,3788.0,1449.0,459936.0,105430.0,when made promise tapi abraham swore himself nomor greater tapi swear hebrews
7729,10561,10561,65493,568720166973870081,2015-02-20 10:33:48+00:00,https://twitter.com/lilo623/status/568720166973870081,"@TheLastFranky #GodBlessYou also, Franky",1,1,0,,88394635.0,lilo623,"NW Washington state, USA🇺🇸",33212.0,7214.0,209999.0,143077.0,godblessyou also franky
7730,10563,10563,22469,568721346898698242,2015-02-20 10:38:30+00:00,https://twitter.com/__Bungs/status/568721346898698242,No more fear about tomorrow and blame for the past... HE will give everything when HE says that HE love you,2,0,1,,914271535.0,__Bungs,Indonesia,3788.0,1449.0,459936.0,105430.0,nomor more fear about tomorrow blame pasti will give everything when says that cinta
7731,10565,10565,22467,568725281206243328,2015-02-20 10:54:08+00:00,https://twitter.com/__Bungs/status/568725281206243328,"Happy Friday everyone , be strong, be humble and keep pray ♥♡ God bless http://t.co/54fPByfFMB",4,0,3,,914271535.0,__Bungs,Indonesia,3788.0,1449.0,459936.0,105430.0,bahagia friday everyone strong humble keep pray bless
7732,10566,10566,22466,568738015855521792,2015-02-20 11:44:44+00:00,https://twitter.com/__Bungs/status/568738015855521792,"Great people in God, not created out of convenience, comfort, happiness and success, but they are created through adversity and complexity",3,0,3,,914271535.0,__Bungs,Indonesia,3788.0,1449.0,459936.0,105430.0,great people created convenience comfort happiness success they created through adversity complexity
7733,10567,10567,22465,568805354735153152,2015-02-20 16:12:19+00:00,https://twitter.com/__Bungs/status/568805354735153152,All your sons will be taught of the LORD; and the well-being of your sons will be great -Isaiah 54:13 http://t.co/yYVJmFnO1y,0,0,0,,914271535.0,__Bungs,Indonesia,3788.0,1449.0,459936.0,105430.0,your sons will taught lord well being your sons will great isaiah
7734,10568,10568,22464,568831823800709121,2015-02-20 17:57:29+00:00,https://twitter.com/__Bungs/status/568831823800709121,"Father touch my heart, You formed my heart like a vessel of pure gold, Amen",1,0,0,,914271535.0,__Bungs,Indonesia,3788.0,1449.0,459936.0,105430.0,father touch heart formed heart like vessel pure gold amin
7735,10569,10569,22463,568832975091077120,2015-02-20 18:02:04+00:00,https://twitter.com/__Bungs/status/568832975091077120,"When me through this life, sometimes I could not, you know my God is the answer",0,0,0,,914271535.0,__Bungs,Indonesia,3788.0,1449.0,459936.0,105430.0,when through this life sometimes could know answer
7736,10570,10570,22462,568833414964465664,2015-02-20 18:03:49+00:00,https://twitter.com/__Bungs/status/568833414964465664,"Thy promise like the dawn, and your love like a river flowing",0,0,0,,914271535.0,__Bungs,Indonesia,3788.0,1449.0,459936.0,105430.0,promise like dawn your cinta like river flowing
7737,10571,10571,22461,568866685219794944,2015-02-20 20:16:01+00:00,https://twitter.com/__Bungs/status/568866685219794944,He will restore the hearts of the fathers to their children and the hearts of the children to their fathers -Malachi 4:6,0,0,0,,914271535.0,__Bungs,Indonesia,3788.0,1449.0,459936.0,105430.0,will restore hearts fathers tapi their children hearts children tapi their fathers malachi
7738,10572,10572,22460,568867282912354304,2015-02-20 20:18:23+00:00,https://twitter.com/__Bungs/status/568867282912354304,"My sheep hear My voice, and I know them, and they follow Me and no one will snatch them out of My hand -John 10:27-29 http://t.co/3ylUTBhhGo",0,0,0,,914271535.0,__Bungs,Indonesia,3788.0,1449.0,459936.0,105430.0,sheep hear voice know them they follow nomor will snatch them hand john
7739,10573,10573,22459,568867533056385024,2015-02-20 20:19:23+00:00,https://twitter.com/__Bungs/status/568867533056385024,"Grow in the grace &amp; knowledge of our Lord and Savior Jesus Christ. To Him be the glory, both now &amp; to the day of eternity -2 Peter 3:18",0,0,0,,914271535.0,__Bungs,Indonesia,3788.0,1449.0,459936.0,105430.0,grow grace knowledge kami lord savior jesus christ tapi glory both tapi eternity peter
7740,10574,10574,22458,568867715827412992,2015-02-20 20:20:07+00:00,https://twitter.com/__Bungs/status/568867715827412992,"For the Scripture says, ""Whoever believes in Him will not be disappointed -Romans 10:11 http://t.co/pbp2VJxSYn",1,0,0,,914271535.0,__Bungs,Indonesia,3788.0,1449.0,459936.0,105430.0,scripture says whoever believes will disappointed romans
7741,10575,10575,22457,568869082075766784,2015-02-20 20:25:32+00:00,https://twitter.com/__Bungs/status/568869082075766784,"To endow those who love me with wealth, that I may fill their treasuries -Proverbs 8:21 http://t.co/s7Fh9bWuHa",0,0,0,,914271535.0,__Bungs,Indonesia,3788.0,1449.0,459936.0,105430.0,tapi endow those cinta dengan wealth that fill their treasuries proverbs
7742,10576,10576,22456,568869455364624384,2015-02-20 20:27:01+00:00,https://twitter.com/__Bungs/status/568869455364624384,For then you will delight in the Almighty and lift up your face to God -Job 22:26 http://t.co/4HovmFdwIe,1,0,0,,914271535.0,__Bungs,Indonesia,3788.0,1449.0,459936.0,105430.0,then will delight almighty lift your face tapi
7743,10577,10577,22455,568886787961065472,2015-02-20 21:35:54+00:00,https://twitter.com/__Bungs/status/568886787961065472,"Though I walk in the midst of trouble, You will revive me; You will stretch forth Your hand and Your right hand will save me -Psalm 138:7",0,0,0,,914271535.0,__Bungs,Indonesia,3788.0,1449.0,459936.0,105430.0,though walk midst trouble will revive will stretch forth your hand your right hand will save psalm
7744,10578,10578,22454,568887385234104321,2015-02-20 21:38:16+00:00,https://twitter.com/__Bungs/status/568887385234104321,"These things I have spoken to you so that My joy may be in you, and that your joy may be made full -John 15:11 http://t.co/WFq5b60YDG",1,0,0,,914271535.0,__Bungs,Indonesia,3788.0,1449.0,459936.0,105430.0,these things have spoken tapi that that your made full john
7745,10580,10580,22452,568889700838043648,2015-02-20 21:47:28+00:00,https://twitter.com/__Bungs/status/568889700838043648,"I sought the LORD, and He answered me, and delivered me from all my fears -Psalm 34:4 http://t.co/ePyMwMfCe7",7,0,5,,914271535.0,__Bungs,Indonesia,3788.0,1449.0,459936.0,105430.0,sought lord answered delivered from fears psalm
7746,10581,10581,22451,568890593054625792,2015-02-20 21:51:01+00:00,https://twitter.com/__Bungs/status/568890593054625792,"My flesh and my heart may fail, but God is the strength of my heart and my portion forever -Psalm 73:26 http://t.co/hS7BtTdwr4",2,0,0,,914271535.0,__Bungs,Indonesia,3788.0,1449.0,459936.0,105430.0,flesh heart fail strength heart portion forever psalm
7747,10582,10582,22450,568892347909476352,2015-02-20 21:57:59+00:00,https://twitter.com/__Bungs/status/568892347909476352,"He defended us and crucified, His suffering gives us an example of eternal fidelity",0,0,0,,914271535.0,__Bungs,Indonesia,3788.0,1449.0,459936.0,105430.0,defended crucified suffering gives example eternal fidelity
7748,10584,10584,22448,568894891540946944,2015-02-20 22:08:06+00:00,https://twitter.com/__Bungs/status/568894891540946944,"Faithful is He who calls you, and He also will bring it to pass -1 Thessalonians 5:24 http://t.co/ZGNizTtu4I",3,0,1,,914271535.0,__Bungs,Indonesia,3788.0,1449.0,459936.0,105430.0,faithful calls also will bring tapi thessalonians
7749,10585,10585,22447,568895305204150272,2015-02-20 22:09:44+00:00,https://twitter.com/__Bungs/status/568895305204150272,"So very tired, but I hope your dreams come true http://t.co/vQgelFfhE7",0,0,0,,914271535.0,__Bungs,Indonesia,3788.0,1449.0,459936.0,105430.0,very tired hope your dreams come true
7750,10587,10587,22445,568897110206099457,2015-02-20 22:16:55+00:00,https://twitter.com/__Bungs/status/568897110206099457,"God is the answer to all of life, by Him we hope will come true",1,0,0,,914271535.0,__Bungs,Indonesia,3788.0,1449.0,459936.0,105430.0,answer tapi life hope will come true
7751,10593,10593,22440,568921513941807104,2015-02-20 23:53:53+00:00,https://twitter.com/__Bungs/status/568921513941807104,"Stay focused on God, Amen",0,0,0,,914271535.0,__Bungs,Indonesia,3788.0,1449.0,459936.0,105430.0,stay focused amin
7752,10594,10594,22439,568925721638236160,2015-02-21 00:10:36+00:00,https://twitter.com/__Bungs/status/568925721638236160,"God is eternal guarantee, without His love, our lives such as cotton",1,0,0,,914271535.0,__Bungs,Indonesia,3788.0,1449.0,459936.0,105430.0,eternal guarantee without cinta kami lives such cotton
7753,10595,10595,22438,568926305179185152,2015-02-21 00:12:55+00:00,https://twitter.com/__Bungs/status/568926305179185152,Build a hope better than waiting,0,0,0,,914271535.0,__Bungs,Indonesia,3788.0,1449.0,459936.0,105430.0,build hope lebih baik tahan waiting
7754,10596,10596,22437,568927204161167360,2015-02-21 00:16:30+00:00,https://twitter.com/__Bungs/status/568927204161167360,"The real world is very unique when we make beautiful, but if we make colorless will be tasteless",0,0,0,,914271535.0,__Bungs,Indonesia,3788.0,1449.0,459936.0,105430.0,real world very unique when memakai beautiful memakai colorless will tasteless
7755,10597,10597,22436,568931434104115200,2015-02-21 00:33:18+00:00,https://twitter.com/__Bungs/status/568931434104115200,"Do not hate other religions, but learn from other religions, and God will equip you with the power of faith",1,0,0,,914271535.0,__Bungs,Indonesia,3788.0,1449.0,459936.0,105430.0,hate other religions learn from other religions will equip dengan power faith
7756,10598,10598,22435,568932971597574144,2015-02-21 00:39:25+00:00,https://twitter.com/__Bungs/status/568932971597574144,"I am Yahweh, that is my name. I will not give my glory to another - Isaiah 42:8",1,0,0,,914271535.0,__Bungs,Indonesia,3788.0,1449.0,459936.0,105430.0,sama yahweh that name will give glory tapi another isaiah
7757,10599,10599,22434,568933151013150721,2015-02-21 00:40:08+00:00,https://twitter.com/__Bungs/status/568933151013150721,My salvation and my honor rely on God - Psalm 62:7,0,0,0,,914271535.0,__Bungs,Indonesia,3788.0,1449.0,459936.0,105430.0,salvation honor rely psalm
7758,10600,10600,22433,568933334409027584,2015-02-21 00:40:51+00:00,https://twitter.com/__Bungs/status/568933334409027584,Trust the Lord with all your heart. Don't rely on your own insight - Proverbs 3:5,0,0,0,,914271535.0,__Bungs,Indonesia,3788.0,1449.0,459936.0,105430.0,trust lord dengan your heart rely your insight proverbs
7759,10601,10601,22432,568933430194339840,2015-02-21 00:41:14+00:00,https://twitter.com/__Bungs/status/568933430194339840,Change your mind and be baptized in Jesus Christ’s name so your sins may be forgiven - Acts 2:38,0,0,0,,914271535.0,__Bungs,Indonesia,3788.0,1449.0,459936.0,105430.0,change your mind baptized jesus christ name your sins forgiven acts
7760,10602,10602,22431,568933507042422785,2015-02-21 00:41:33+00:00,https://twitter.com/__Bungs/status/568933507042422785,"When the Spirit of Truth comes, he'll guide you into all truth - John 16:13",0,0,0,,914271535.0,__Bungs,Indonesia,3788.0,1449.0,459936.0,105430.0,when spirit truth comes guide into truth john
7761,10603,10603,22430,568933721195175936,2015-02-21 00:42:24+00:00,https://twitter.com/__Bungs/status/568933721195175936,Watch yourselves so that you don’t lose what we worked for - 2 John 8,0,0,0,,914271535.0,__Bungs,Indonesia,3788.0,1449.0,459936.0,105430.0,watch yourselves that lose what worked john
7762,10604,10604,22429,568934279637372929,2015-02-21 00:44:37+00:00,https://twitter.com/__Bungs/status/568934279637372929,"Rejoice and be glad, for your reward will be great in heaven - Matthew 5:12",0,0,0,,914271535.0,__Bungs,Indonesia,3788.0,1449.0,459936.0,105430.0,rejoice glad your reward will great heaven matthew
7763,10606,10606,65489,568945667961425922,2015-02-21 01:29:52+00:00,https://twitter.com/cardlady55/status/568945667961425922,@TheLastFranky @elliesangelwing @tummuuu @RachelGrumbine @alisaregenold How are things? Are you in deep freeze too?,3,3,0,,2321430788.0,cardlady55,heaven bound,4099.0,3991.0,36279.0,19710.0,things deep freeze
7764,10608,10608,65487,568948442627751936,2015-02-21 01:40:53+00:00,https://twitter.com/cardlady55/status/568948442627751936,@TheLastFranky @elliesangelwing @tummuuu @RachelGrumbine @alisaregenold Awesome! Spring is coming! I believe!🌷🌸🍀,2,1,0,,2321430788.0,cardlady55,heaven bound,4099.0,3991.0,36279.0,19710.0,awesome spring coming believe
7765,10610,10610,65485,568952319464710144,2015-02-21 01:56:18+00:00,https://twitter.com/RachelGrumbine/status/568952319464710144,"@TheLastFranky @cardlady55 @elliesangelwing @tummuuu @alisaregenold yes, 🌻💐God blessed us with a beautiful day!!🌺",3,2,2,,2724308804.0,RachelGrumbine,"Los Angeles, CA ",44536.0,40767.0,53030.0,151471.0,blessed dengan beautiful
7766,10611,10611,65484,568952356299276288,2015-02-21 01:56:27+00:00,https://twitter.com/sherilw62/status/568952356299276288,@TheLastFranky @TeresaBGordon. What does that mean? Hmmm.......,1,1,0,,2623373627.0,sherilw62,,34387.0,9183.0,280241.0,143091.0,what does that mean hmmm
7767,10612,10612,65483,568952752212037632,2015-02-21 01:58:01+00:00,https://twitter.com/RachelGrumbine/status/568952752212037632,@TheLastFranky @elliesangelwing @tummuuu @alisaregenold @amanda7743 @cardlady55 @missylenza 🌻🌺Hello God bless you! It's been a summer day!,4,1,0,,2724308804.0,RachelGrumbine,"Los Angeles, CA ",44536.0,40767.0,53030.0,151471.0,hello bless been summer
7768,10613,10613,65482,568952891001565185,2015-02-21 01:58:34+00:00,https://twitter.com/RachelGrumbine/status/568952891001565185,@TheLastFranky @cardlady55 @elliesangelwing @tummuuu @alisaregenold Kids are on winter break-it's been so nice🍀🌷🌸,3,1,1,,2724308804.0,RachelGrumbine,"Los Angeles, CA ",44536.0,40767.0,53030.0,151471.0,kids winter break been bagus
7769,10615,10615,65480,568953361199792128,2015-02-21 02:00:26+00:00,https://twitter.com/RachelGrumbine/status/568953361199792128,@TheLastFranky @tummuuu @alisaregenold @elliesangelwing @amanda7743 @cardlady55 @missylenza 👑Jesus👑Thank you for your Sacrafice!God is good!,3,1,2,,2724308804.0,RachelGrumbine,"Los Angeles, CA ",44536.0,40767.0,53030.0,151471.0,jesus thank your sacrafice bagus
7770,10619,10619,65476,568956161678020608,2015-02-21 02:11:34+00:00,https://twitter.com/sherilw62/status/568956161678020608,"@TheLastFranky @TeresaBGordon. Ok Franky, its just habit to a man :)",2,1,0,,2623373627.0,sherilw62,,34387.0,9183.0,280241.0,143091.0,franky just habit tapi
7771,10620,10620,65475,568956400208105473,2015-02-21 02:12:31+00:00,https://twitter.com/cardlady55/status/568956400208105473,"@TheLastFranky @elliesangelwing @alisaregenold @tummuuu @RachelGrumbine Ok I think I changed something it may help. Not real smart here,lol",2,2,1,,2321430788.0,cardlady55,heaven bound,4099.0,3991.0,36279.0,19710.0,think changed something help real smart here tertawa
7772,10621,10621,65474,568956604348895234,2015-02-21 02:13:19+00:00,https://twitter.com/RachelGrumbine/status/568956604348895234,@TheLastFranky @cardlady55 @elliesangelwing @tummuuu @alisaregenold 🌹💞👑Jesus blessed Lord!🎶❤️💕🎶,3,1,1,,2724308804.0,RachelGrumbine,"Los Angeles, CA ",44536.0,40767.0,53030.0,151471.0,jesus blessed lord
7773,10622,10622,22428,568959092619808768,2015-02-21 02:23:13+00:00,https://twitter.com/__Bungs/status/568959092619808768,"For if we go on sinning willfully after receiving the knowledge of the truth, there no longer remains a sacrifice for sins -Hebrews 10:26",0,0,0,,914271535.0,__Bungs,Indonesia,3788.0,1449.0,459936.0,105430.0,sinning willfully after receiving knowledge truth there nomor longer remains sacrifice sins hebrews
7774,10623,10623,65473,568959540269420544,2015-02-21 02:24:59+00:00,https://twitter.com/elliesangelwing/status/568959540269420544,@TheLastFranky @cardlady55 @alisaregenold @tummuuu @RachelGrumbine  ok by for now tweet later. Prayer meeting starting now.,5,3,2,,31620465.0,elliesangelwing,United States,110451.0,90400.0,300986.0,387151.0,tweet later prayer meeting starting
7775,10624,10624,65472,568961734360178688,2015-02-21 02:33:42+00:00,https://twitter.com/RachelGrumbine/status/568961734360178688,@TheLastFranky @elliesangelwing @cardlady55 @alisaregenold @tummuuu 🎶❤️💕See you next time!! God bless you!!😄😊☺️😘🐤,3,0,1,,2724308804.0,RachelGrumbine,"Los Angeles, CA ",44536.0,40767.0,53030.0,151471.0,lanjut time bless
7776,10627,10627,65469,568970800742600705,2015-02-21 03:09:44+00:00,https://twitter.com/RachelGrumbine/status/568970800742600705,@TheLastFranky @tummuuu @alisaregenold @elliesangelwing @amanda7743 @cardlady55 @missylenza Amen! Keep the prayers up,6,1,2,,2724308804.0,RachelGrumbine,"Los Angeles, CA ",44536.0,40767.0,53030.0,151471.0,amin keep prayers
7777,10628,10628,65468,568974351938101248,2015-02-21 03:23:51+00:00,https://twitter.com/RachelGrumbine/status/568974351938101248,@TheLastFranky @tummuuu @alisaregenold @elliesangelwing @amanda7743 @cardlady55 @missylenza 💞💖💕Nothing is by chance everything is divine apt,4,1,4,,2724308804.0,RachelGrumbine,"Los Angeles, CA ",44536.0,40767.0,53030.0,151471.0,nothing chance everything divine
7778,10629,10629,65467,568977361565306880,2015-02-21 03:35:48+00:00,https://twitter.com/elliesangelwing/status/568977361565306880,@TheLastFranky @RachelGrumbine @tummuuu @alisaregenold @amanda7743 @cardlady55 @missylenza  Lord through hard times &amp; happy times Lord,4,1,3,,31620465.0,elliesangelwing,United States,110451.0,90400.0,300986.0,387151.0,lord through hard times bahagia times lord
7779,10631,10631,65466,569003981218951169,2015-02-21 05:21:35+00:00,https://twitter.com/sherilw62/status/569003981218951169,"@TheLastFranky. God bless u Franky
Keep it going man! Ur on a roll for the Lord!",1,1,0,,2623373627.0,sherilw62,,34387.0,9183.0,280241.0,143091.0,bless franky keep going roll lord
