,Unnamed: 0.1,Unnamed: 0,index,Id,Tweet Time,Url,Tweet Text,Likes Count,Reply Count,Retweet Count,Retweeted Tweet,User Id,User Name,User Location,User Follower Count,User Following Count,User Likes Count,User Tweets Count,text_clean
6688,9304,9304,23558,561805272696385536,2015-02-01 08:36:29+00:00,https://twitter.com/__Bungs/status/561805272696385536,"Through the Holy Spirit, Jesus instructed the missionaries whom he had selected -Acts 1:2 http://t.co/O0CnLRa0nA",1,0,0,,914271535.0,__Bungs,Indonesia,3788.0,1449.0,459936.0,105430.0,through holy spirit jesus instructed missionaries whom selected acts
6689,9305,9305,23557,561806435709751296,2015-02-01 08:41:06+00:00,https://twitter.com/__Bungs/status/561806435709751296,"The Lord is the Spirit, and wherever the Lord’s Spirit is, there is freedom. -2 Corinthians 3:17",0,0,0,,914271535.0,__Bungs,Indonesia,3788.0,1449.0,459936.0,105430.0,lord spirit wherever lord spirit there freedom corinthians
6690,9306,9306,23556,561806648264515584,2015-02-01 08:41:57+00:00,https://twitter.com/__Bungs/status/561806648264515584,"Happy Sunday to everyone, God Bless...Amen",0,0,0,,914271535.0,__Bungs,Indonesia,3788.0,1449.0,459936.0,105430.0,bahagia sunday tapi everyone bless amin
6691,9307,9307,23555,561807549549129730,2015-02-01 08:45:32+00:00,https://twitter.com/__Bungs/status/561807549549129730,"Our good news didn’t come to you by a message alone, but also by power, by the Holy Spirit and by deep conviction -1 Thessalonians 1:5",1,0,0,,914271535.0,__Bungs,Indonesia,3788.0,1449.0,459936.0,105430.0,kami bagus news didn come tapi message alone also power holy spirit deep conviction thessalonians
6692,9308,9308,23554,561807969407361024,2015-02-01 08:47:12+00:00,https://twitter.com/__Bungs/status/561807969407361024,There is one body and one Spirit—just as you were called into one hope. -Ephesians 4:4 http://t.co/S41BDylOk5,1,0,0,,914271535.0,__Bungs,Indonesia,3788.0,1449.0,459936.0,105430.0,there body spirit just were called into hope ephesians
6693,9309,9309,23553,561838087752273920,2015-02-01 10:46:53+00:00,https://twitter.com/__Bungs/status/561838087752273920,Guard yourselves and all the flock in which the Holy Spirit has made you supervisors. -Acts 20:28 http://t.co/k75TqrWefA,1,0,0,,914271535.0,__Bungs,Indonesia,3788.0,1449.0,459936.0,105430.0,guard yourselves flock which holy spirit made supervisors acts
6694,9310,9310,23552,561963089348661248,2015-02-01 19:03:35+00:00,https://twitter.com/__Bungs/status/561963089348661248,"We don’t speak these thoughts in words taught by human wisdom, but in words taught by the Spirit. -1 Corinthians 2:13 http://t.co/eiVkXlRFEf",0,0,0,,914271535.0,__Bungs,Indonesia,3788.0,1449.0,459936.0,105430.0,speak these thoughts words taught human wisdom words taught spirit corinthians
6695,9311,9311,23551,561963644875841536,2015-02-01 19:05:48+00:00,https://twitter.com/__Bungs/status/561963644875841536,After becoming believers… you were sealed with the promised Holy Spirit. -Ephesians 1:13 http://t.co/xOBChMvUDQ,1,0,0,,914271535.0,__Bungs,Indonesia,3788.0,1449.0,459936.0,105430.0,after becoming believers were sealed dengan promised holy spirit ephesians
6696,9312,9312,23550,561964907856281600,2015-02-01 19:10:49+00:00,https://twitter.com/__Bungs/status/561964907856281600,We don’t know how we should pray as is necessary. But the Spirit intercedes for us. -Romans 8:26 http://t.co/54v3HyKVYV,0,0,0,,914271535.0,__Bungs,Indonesia,3788.0,1449.0,459936.0,105430.0,know should pray necessary spirit intercedes romans
6697,9313,9313,23549,561965230318567424,2015-02-01 19:12:06+00:00,https://twitter.com/__Bungs/status/561965230318567424,"As God’s chosen, holy, and beloved people, put on compassion, kindness, humility, and tolerance - Colossians 3:12 http://t.co/Ii0L1rfzU3",0,0,0,,914271535.0,__Bungs,Indonesia,3788.0,1449.0,459936.0,105430.0,chosen holy beloved people compassion kindness humility tolerance colossians
6698,9314,9314,23548,561965561257529344,2015-02-01 19:13:25+00:00,https://twitter.com/__Bungs/status/561965561257529344,"For I said, Steadfast love will be built up forever; in the heavens you will establish your faithfulness ~ Psalm 89:2 http://t.co/uv6FIBc70H",0,0,0,,914271535.0,__Bungs,Indonesia,3788.0,1449.0,459936.0,105430.0,said steadfast cinta will built forever heavens will establish your faithfulness psalm
6699,9315,9315,23547,562000951683194881,2015-02-01 21:34:03+00:00,https://twitter.com/__Bungs/status/562000951683194881,"For the ways of man are before the eyes of the LORD, and He ponders all his paths -Proverbs 5:21 http://t.co/ppLPeCZQeI",0,0,0,,914271535.0,__Bungs,Indonesia,3788.0,1449.0,459936.0,105430.0,ways before eyes lord ponders paths proverbs
6700,9316,9316,23546,562002221185761280,2015-02-01 21:39:05+00:00,https://twitter.com/__Bungs/status/562002221185761280,Take up the whole armor of God so you may be able to stand in the evil day - Ephesians 6:13 http://t.co/tL5JyUPLgu,0,0,0,,914271535.0,__Bungs,Indonesia,3788.0,1449.0,459936.0,105430.0,take whole armor able tapi stand evil ephesians
6701,9317,9317,23545,562002479487782913,2015-02-01 21:40:07+00:00,https://twitter.com/__Bungs/status/562002479487782913,Through one person’s disobedience many became sinners. And through one person’s obedience many will become righteous - Romans 5:19,0,0,0,,914271535.0,__Bungs,Indonesia,3788.0,1449.0,459936.0,105430.0,through person disobedience many became sinners through person obedience many will become righteous romans
6702,9318,9318,23544,562002749143789570,2015-02-01 21:41:11+00:00,https://twitter.com/__Bungs/status/562002749143789570,Always be prepared to answer everyone who asks you a reason for the hope within you - 1 Peter 3:15 http://t.co/I0jqQ30ron,0,0,0,,914271535.0,__Bungs,Indonesia,3788.0,1449.0,459936.0,105430.0,always prepared tapi answer everyone asks reason hope within peter
6703,9321,9321,23541,562005637438009345,2015-02-01 21:52:40+00:00,https://twitter.com/__Bungs/status/562005637438009345,"When you hear wars and instability, do not be terrified, for these must happen first. It’s not yet the end -Luke 21:9 http://t.co/auuOemJUlw",0,0,0,,914271535.0,__Bungs,Indonesia,3788.0,1449.0,459936.0,105430.0,when hear wars instability terrified these must happen first luke
6704,9322,9322,23540,562006240444694528,2015-02-01 21:55:03+00:00,https://twitter.com/__Bungs/status/562006240444694528,A righteous person’s prayer is very powerful and effective - James 5:16 http://t.co/1pjoeKqacG,0,0,0,,914271535.0,__Bungs,Indonesia,3788.0,1449.0,459936.0,105430.0,righteous person prayer very powerful effective james
6705,9323,9323,23539,562006711586680833,2015-02-01 21:56:56+00:00,https://twitter.com/__Bungs/status/562006711586680833,"Kneel to the Lord, for he hears the sound of my prayers - Psalm 28:6 http://t.co/V46NcsHzH5",0,0,0,,914271535.0,__Bungs,Indonesia,3788.0,1449.0,459936.0,105430.0,kneel tapi lord hears sound prayers psalm
6706,9324,9324,23538,562007187879243776,2015-02-01 21:58:49+00:00,https://twitter.com/__Bungs/status/562007187879243776,One is given words of wisdom through the Spirit. Another is given words of knowledge. -1 Corinthians 12:8 http://t.co/ZjIRjok5zx,0,0,0,,914271535.0,__Bungs,Indonesia,3788.0,1449.0,459936.0,105430.0,given words wisdom through spirit another given words knowledge corinthians
6707,9325,9325,23537,562011106495836161,2015-02-01 22:14:24+00:00,https://twitter.com/__Bungs/status/562011106495836161,"Where your treasure is, there also your thoughts will be -- Luke 12:34 http://t.co/PmHPGwZlYq",0,0,0,,914271535.0,__Bungs,Indonesia,3788.0,1449.0,459936.0,105430.0,where your treasure there also your thoughts will luke
6708,9326,9326,23536,562160865894359040,2015-02-02 08:09:29+00:00,https://twitter.com/__Bungs/status/562160865894359040,"God’s peace, which exceeds all understanding, will protect your hearts and your thoughts - Philippians 4:7 http://t.co/8pa9BxkKoK",0,0,0,,914271535.0,__Bungs,Indonesia,3788.0,1449.0,459936.0,105430.0,peace which exceeds understanding will protect your hearts your thoughts philippians
6709,9327,9327,23535,562166201481035776,2015-02-02 08:30:41+00:00,https://twitter.com/__Bungs/status/562166201481035776,God our Savior... saved us – but not because of righteous works which we had done - Titus 3:4-5 http://t.co/1MZ3OtXGBh,0,0,0,,914271535.0,__Bungs,Indonesia,3788.0,1449.0,459936.0,105430.0,kami savior saved because righteous works which done titus
6710,9328,9328,23534,562166486886662145,2015-02-02 08:31:49+00:00,https://twitter.com/__Bungs/status/562166486886662145,My soul finds rest in God alone because my confidence comes from him - Psalm 62:5 http://t.co/9XV2Xl9wQL,1,0,0,,914271535.0,__Bungs,Indonesia,3788.0,1449.0,459936.0,105430.0,soul finds rest alone because confidence comes from psalm
6711,9329,9329,23533,562166833193566208,2015-02-02 08:33:12+00:00,https://twitter.com/__Bungs/status/562166833193566208,"I have been crucified with Christ. I live no more, instead Christ lives in me - Galatians 2:20 http://t.co/ViutXJx5tO",0,0,0,,914271535.0,__Bungs,Indonesia,3788.0,1449.0,459936.0,105430.0,have been crucified dengan christ live nomor more instead christ lives galatians
6712,9330,9330,23532,562167853810339841,2015-02-02 08:37:15+00:00,https://twitter.com/__Bungs/status/562167853810339841,Unto us a Child is born. Unto us a Son is given. And the government will be upon His shoulders - Isaiah 9:6 http://t.co/iFO6mRnlQS,0,0,0,,914271535.0,__Bungs,Indonesia,3788.0,1449.0,459936.0,105430.0,unto child born unto given government will upon shoulders isaiah
6713,9331,9331,23531,562176624347471872,2015-02-02 09:12:06+00:00,https://twitter.com/__Bungs/status/562176624347471872,"Jesus said, “All who live and trust me will certainly not die for eternity’ - John 11:26 http://t.co/lFvgsQmQ3E",0,0,0,,914271535.0,__Bungs,Indonesia,3788.0,1449.0,459936.0,105430.0,jesus said live trust will certainly eternity john
6714,9332,9332,23530,562176965893840896,2015-02-02 09:13:28+00:00,https://twitter.com/__Bungs/status/562176965893840896,With one accord and with one voice... honor the God and Father of our Lord Jesus - Romans 15:6 http://t.co/MuHKsOjZ9L,0,0,0,,914271535.0,__Bungs,Indonesia,3788.0,1449.0,459936.0,105430.0,dengan sesuai dengan voice honor father kami lord jesus romans
6715,9333,9333,23529,562177660915154945,2015-02-02 09:16:13+00:00,https://twitter.com/__Bungs/status/562177660915154945,When you were dead in your sins... God gave you life - Colossians 2:13 http://t.co/K9e97XUSFi,1,0,0,,914271535.0,__Bungs,Indonesia,3788.0,1449.0,459936.0,105430.0,when were dead your sins gave life colossians
6716,9334,9334,23528,562179018007396352,2015-02-02 09:21:37+00:00,https://twitter.com/__Bungs/status/562179018007396352,"Then Jesus said, ""Did I not tell you that if you believed, you would see the glory of God?"" -John 11:40 http://t.co/aEVvkfehRi",0,0,0,,914271535.0,__Bungs,Indonesia,3788.0,1449.0,459936.0,105430.0,then jesus said tell that believed would glory john
6717,9335,9335,23527,562193124810686464,2015-02-02 10:17:40+00:00,https://twitter.com/__Bungs/status/562193124810686464,"Repent, then, and turn to God, so that your sins may be wiped out, that times of refreshing may come from the Lord -Acts 3:19",0,0,0,,914271535.0,__Bungs,Indonesia,3788.0,1449.0,459936.0,105430.0,repent then turn tapi that your sins wiped that times refreshing come from lord acts
6718,9336,9336,23526,562193481687248896,2015-02-02 10:19:05+00:00,https://twitter.com/__Bungs/status/562193481687248896,"Faith is the assurance of things hoped for, the conviction of things not seen - Hebrews 11:1 http://t.co/7Ixa2TME4e",0,0,0,,914271535.0,__Bungs,Indonesia,3788.0,1449.0,459936.0,105430.0,faith assurance things hoped conviction things seen hebrews
6719,9337,9337,23525,562193819139969024,2015-02-02 10:20:26+00:00,https://twitter.com/__Bungs/status/562193819139969024,Whoever comes to God must have faith that he exists and that he rewards those who seek him - Hebrews 11:6 http://t.co/U7bAH7L4BT,0,0,0,,914271535.0,__Bungs,Indonesia,3788.0,1449.0,459936.0,105430.0,whoever comes tapi must have faith that exists that rewards those seek hebrews
6720,9338,9338,23524,562194322280300547,2015-02-02 10:22:26+00:00,https://twitter.com/__Bungs/status/562194322280300547,God will make a way out so you can endure pressure - 1 Corinthians 10:13 http://t.co/RjlQ57ZZdZ,0,0,0,,914271535.0,__Bungs,Indonesia,3788.0,1449.0,459936.0,105430.0,will memakai belum endure pressure corinthians
6721,9339,9339,23523,562194766536785921,2015-02-02 10:24:12+00:00,https://twitter.com/__Bungs/status/562194766536785921,God chose us... prior to the world‘s creation to be holy and without fault before him - Ephesians 1:4 http://t.co/g9jCB9VBQN,0,0,0,,914271535.0,__Bungs,Indonesia,3788.0,1449.0,459936.0,105430.0,chose prior tapi world creation tapi holy without fault before ephesians
6722,9340,9340,23522,562209676293447681,2015-02-02 11:23:26+00:00,https://twitter.com/__Bungs/status/562209676293447681,Turn away from evil and do good. Seek peace and pursue it - Psalm 34:14 http://t.co/LtgxNMITpS,0,0,0,,914271535.0,__Bungs,Indonesia,3788.0,1449.0,459936.0,105430.0,turn away from evil bagus seek peace pursue psalm
6723,9341,9341,23521,562210388024913920,2015-02-02 11:26:16+00:00,https://twitter.com/__Bungs/status/562210388024913920,"By baptism, you were buried with him and were raised with him - Colossians 2:12 http://t.co/kYU7P89pEj",3,1,2,,914271535.0,__Bungs,Indonesia,3788.0,1449.0,459936.0,105430.0,baptism were buried dengan were raised dengan colossians
6724,9342,9342,23520,562212727922229248,2015-02-02 11:35:34+00:00,https://twitter.com/__Bungs/status/562212727922229248,"In your relationships with one another, have the same attitude of mind Christ Jesus had: -Philippians 2:5 http://t.co/oleo6uRM0Y",4,0,3,,914271535.0,__Bungs,Indonesia,3788.0,1449.0,459936.0,105430.0,your relationships dengan another have same attitude mind christ jesus philippians
6725,9343,9343,23519,562213050690707457,2015-02-02 11:36:51+00:00,https://twitter.com/__Bungs/status/562213050690707457,"What is desired in a man is kindness, and a poor man is better than a liar. -Proverbs 19:22 http://t.co/hVpl1G1ITp",2,0,0,,914271535.0,__Bungs,Indonesia,3788.0,1449.0,459936.0,105430.0,what desired kindness poor lebih baik tahan liar proverbs
6726,9345,9345,23518,562219527799201792,2015-02-02 12:02:35+00:00,https://twitter.com/__Bungs/status/562219527799201792,"I walked with the light of God, wherever I was never dark, always awake and always blessed by Him",0,0,0,,914271535.0,__Bungs,Indonesia,3788.0,1449.0,459936.0,105430.0,walked dengan terang wherever never dark always awake always blessed
6727,9346,9346,23517,562221273028128768,2015-02-02 12:09:31+00:00,https://twitter.com/__Bungs/status/562221273028128768,"Doubts grow because we are not confident with everything that is blessed, all be glowing if we put his name in every our step",0,0,0,,914271535.0,__Bungs,Indonesia,3788.0,1449.0,459936.0,105430.0,doubts grow because confident dengan everything that blessed glowing name every kami step
6728,9347,9347,23516,562226129876955136,2015-02-02 12:28:49+00:00,https://twitter.com/__Bungs/status/562226129876955136,"Build up your soul from weakness your heart , build up your heart from silence you soul",0,1,0,,914271535.0,__Bungs,Indonesia,3788.0,1449.0,459936.0,105430.0,build your soul from weakness your heart build your heart from silence soul
6729,9348,9348,23515,562239981133901825,2015-02-02 13:23:52+00:00,https://twitter.com/__Bungs/status/562239981133901825,"And now these three remain: faith, hope and love. But the greatest of these is love - 1 Corinthians 13:13 http://t.co/U6udV9jpOW",0,0,0,,914271535.0,__Bungs,Indonesia,3788.0,1449.0,459936.0,105430.0,these three remain faith hope cinta greatest these cinta corinthians
6730,9349,9349,23514,562241060814872578,2015-02-02 13:28:09+00:00,https://twitter.com/__Bungs/status/562241060814872578,"We brought nothing into the world, nor can we take anything out of it - 1Timothy 6:7 http://t.co/WSV7qeHkF1",0,0,0,,914271535.0,__Bungs,Indonesia,3788.0,1449.0,459936.0,105430.0,brought nothing into world belum take anything timothy
6731,9350,9350,23513,562270006075863040,2015-02-02 15:23:10+00:00,https://twitter.com/__Bungs/status/562270006075863040,"He holds victory in store for the upright, he is a shield to those whose walk is blameless. -Proverbs 2:7 http://t.co/UUAET9stvJ",0,0,0,,914271535.0,__Bungs,Indonesia,3788.0,1449.0,459936.0,105430.0,holds menang store upright shield tapi those whose walk blameless proverbs
6732,9351,9351,23512,562270277833203715,2015-02-02 15:24:15+00:00,https://twitter.com/__Bungs/status/562270277833203715,You’ll see the Son of man sitting at the right of the Mighty One and coming on the clouds of heaven - Matthew 26:64 http://t.co/1VX9FS0cC3,0,0,0,,914271535.0,__Bungs,Indonesia,3788.0,1449.0,459936.0,105430.0,sitting right mighty coming clouds heaven matthew
6733,9352,9352,23511,562271086776049664,2015-02-02 15:27:28+00:00,https://twitter.com/__Bungs/status/562271086776049664,"May you have joy and peace from the One who is, who was, and who is coming - Revelation 1:4 http://t.co/tcwpBiX0Mc",0,0,0,,914271535.0,__Bungs,Indonesia,3788.0,1449.0,459936.0,105430.0,have peace from coming revelation
6734,9353,9353,23510,562271666391089153,2015-02-02 15:29:46+00:00,https://twitter.com/__Bungs/status/562271666391089153,"At the proper time we will harvest, if we don't give up - Galatians 6:9 http://t.co/xuJQeOU4gi",1,0,0,,914271535.0,__Bungs,Indonesia,3788.0,1449.0,459936.0,105430.0,proper time will harvest give galatians
6735,9354,9354,23509,562283481279897600,2015-02-02 16:16:43+00:00,https://twitter.com/__Bungs/status/562283481279897600,"Jesus said, ""I will give those who overcome the right to eat from the life-giving tree which is in God’s garden"" - Revelation 2:7",0,0,2,,914271535.0,__Bungs,Indonesia,3788.0,1449.0,459936.0,105430.0,jesus said will give those overcome right tapi from life giving tree which garden revelation
6736,9355,9355,23508,562285764793225216,2015-02-02 16:25:47+00:00,https://twitter.com/__Bungs/status/562285764793225216,The wolf and the lamb will eat together. The lion will eat straw like a bull - Isaiah 65:24 http://t.co/0b0OFXoF8u,0,0,0,,914271535.0,__Bungs,Indonesia,3788.0,1449.0,459936.0,105430.0,wolf lamb will together lion will straw like bull isaiah
6737,9356,9356,23507,562286432140546048,2015-02-02 16:28:26+00:00,https://twitter.com/__Bungs/status/562286432140546048,"We thank you, Lord God Almight, for you’ve taken your great power and have become king - Revelation 11:17 http://t.co/TaoM5nOQ4K",1,0,0,,914271535.0,__Bungs,Indonesia,3788.0,1449.0,459936.0,105430.0,thank lord almight taken your great power have become king revelation
6738,9357,9357,23506,562286922161078272,2015-02-02 16:30:23+00:00,https://twitter.com/__Bungs/status/562286922161078272,"They’ll be destroyed in their own work of destruction, being harmed as wages for harming others - 2 Peter 2:12-13 http://t.co/IizYv3HpNN",1,0,0,,914271535.0,__Bungs,Indonesia,3788.0,1449.0,459936.0,105430.0,they destroyed their work destruction being harmed wages harming others peter
6739,9358,9358,23505,562287150129897472,2015-02-02 16:31:18+00:00,https://twitter.com/__Bungs/status/562287150129897472,The Lord will guard you from all evil. He will guard your life - Psalm 121:7,1,0,0,,914271535.0,__Bungs,Indonesia,3788.0,1449.0,459936.0,105430.0,lord will guard from evil will guard your life psalm
6740,9359,9359,23504,562287428312920064,2015-02-02 16:32:24+00:00,https://twitter.com/__Bungs/status/562287428312920064,"Worship the Maker of heaven, earth, the sea, and the sources of water - Revelation 14:7 http://t.co/ZpG2x9kedv",1,0,0,,914271535.0,__Bungs,Indonesia,3788.0,1449.0,459936.0,105430.0,worship maker heaven earth sources water revelation
6741,9360,9360,23503,562293849448386560,2015-02-02 16:57:55+00:00,https://twitter.com/__Bungs/status/562293849448386560,"Do not just pain or suffering we pray to God, but in a happy state of matter we keep praying and thanking Him",0,0,0,,914271535.0,__Bungs,Indonesia,3788.0,1449.0,459936.0,105430.0,just pain orang suffering pray tapi bahagia state matter keep praying thanking
6742,9361,9361,65660,562314167039045633,2015-02-02 18:18:39+00:00,https://twitter.com/kstephenson890/status/562314167039045633,"@TheLastFranky When you feel weak, God will give you strengh!✊",1,1,0,,2532159301.0,kstephenson890,"Clermont, FL",3228.0,2005.0,29655.0,57233.0,when feel weak will give strengh
6743,9362,9362,65659,562316221555961856,2015-02-02 18:26:49+00:00,https://twitter.com/kstephenson890/status/562316221555961856,@TheLastFranky Amen! Brother. Have a blessed day!,0,0,0,,2532159301.0,kstephenson890,"Clermont, FL",3228.0,2005.0,29655.0,57233.0,amin brother have blessed
6744,9364,9364,23501,562336080192487425,2015-02-02 19:45:43+00:00,https://twitter.com/__Bungs/status/562336080192487425,Whoever comes to me will not go hungry; whoever believes me will never be thirsty - John 6:35 http://t.co/pJ1XqCv342,1,0,0,,914271535.0,__Bungs,Indonesia,3788.0,1449.0,459936.0,105430.0,whoever comes tapi will hungry whoever believes will never thirsty john
6745,9365,9365,23500,562338105659633664,2015-02-02 19:53:46+00:00,https://twitter.com/__Bungs/status/562338105659633664,It deceived earth’s inhabitants because of the miracles it was given power to do - Revelation 13:14 http://t.co/WB4mIkr5uB,1,0,0,,914271535.0,__Bungs,Indonesia,3788.0,1449.0,459936.0,105430.0,deceived earth inhabitants because miracles given power tapi revelation
6746,9366,9366,23499,562339080768200704,2015-02-02 19:57:39+00:00,https://twitter.com/__Bungs/status/562339080768200704,"Be prepared. –for at an hour you don’t expect, the Son of man will come - Luke 12:40 http://t.co/eEr1gj0SI4",3,1,2,,914271535.0,__Bungs,Indonesia,3788.0,1449.0,459936.0,105430.0,prepared hour expect will come luke
6747,9368,9368,23497,562347590289596417,2015-02-02 20:31:28+00:00,https://twitter.com/__Bungs/status/562347590289596417,Keep Pray and forgive each other,0,0,0,,914271535.0,__Bungs,Indonesia,3788.0,1449.0,459936.0,105430.0,keep pray forgive each other
6748,9369,9369,23496,562361235098722304,2015-02-02 21:25:41+00:00,https://twitter.com/__Bungs/status/562361235098722304,"While they were worshiping the Lord and fasting, the Holy Spirit said, “Set apart for me Barnabas and Saul to do the work”—Acts 13:2",0,0,0,,914271535.0,__Bungs,Indonesia,3788.0,1449.0,459936.0,105430.0,while they were worshiping lord fasting holy spirit said apart barnabas saul tapi work acts
6749,9370,9370,23495,562361499457290240,2015-02-02 21:26:44+00:00,https://twitter.com/__Bungs/status/562361499457290240,There is one body and one Spirit—just as you were called into one hope. -Ephesians 4:4,2,0,0,,914271535.0,__Bungs,Indonesia,3788.0,1449.0,459936.0,105430.0,there body spirit just were called into hope ephesians
6750,9371,9371,23494,562364603317768192,2015-02-02 21:39:04+00:00,https://twitter.com/__Bungs/status/562364603317768192,They shall rise up with wings like eagles. They shall run and not be weary. They shall walk and not faint - Isaiah 40:31,2,0,0,,914271535.0,__Bungs,Indonesia,3788.0,1449.0,459936.0,105430.0,they shall rise dengan wings like eagles they shall weary they shall walk faint isaiah
6751,9373,9373,23492,562508149106548737,2015-02-03 07:09:28+00:00,https://twitter.com/__Bungs/status/562508149106548737,But that no man is justified by law in the sight of GOD it is evident the just shall live by faith -galatians 3:11 http://t.co/Rp1HO2IJC3,0,0,0,,914271535.0,__Bungs,Indonesia,3788.0,1449.0,459936.0,105430.0,that nomor justified sight evident just shall live faith galatians
6752,9374,9374,23491,562508436512849920,2015-02-03 07:10:36+00:00,https://twitter.com/__Bungs/status/562508436512849920,"He that believeth on me, as the scripture hath said, out of his belly shall flow rivers of living water. -John 7:38 http://t.co/c3mRkD5lP0",0,0,0,,914271535.0,__Bungs,Indonesia,3788.0,1449.0,459936.0,105430.0,that believeth scripture hath said belly shall flow rivers living water john
6753,9375,9375,23490,562508786099683328,2015-02-03 07:12:00+00:00,https://twitter.com/__Bungs/status/562508786099683328,The Spirit clearly says that in later times some will leave the faith - 1 Timothy 4:1 http://t.co/cWzTD5XsGR,0,0,0,,914271535.0,__Bungs,Indonesia,3788.0,1449.0,459936.0,105430.0,spirit clearly says that later times some will leave faith timothy
6754,9376,9376,23489,562513712443961344,2015-02-03 07:31:34+00:00,https://twitter.com/__Bungs/status/562513712443961344,A negative mind will never give you a positive life http://t.co/lpNx8uSnFo,0,0,0,,914271535.0,__Bungs,Indonesia,3788.0,1449.0,459936.0,105430.0,negative mind will never give positive life
6755,9377,9377,23488,562514627678842880,2015-02-03 07:35:12+00:00,https://twitter.com/__Bungs/status/562514627678842880,"Without dreams, we reach nothing. Without love, we feel nothing. And without God, we are nothing http://t.co/q9WeUpgOWo",0,0,0,,914271535.0,__Bungs,Indonesia,3788.0,1449.0,459936.0,105430.0,without dreams reach nothing without cinta feel nothing without nothing
6756,9382,9382,23483,562534487074930689,2015-02-03 08:54:07+00:00,https://twitter.com/__Bungs/status/562534487074930689,"Thank God for your participation at any moment, I believe on your power to ease the way for us all, Amen",0,0,0,,914271535.0,__Bungs,Indonesia,3788.0,1449.0,459936.0,105430.0,thank your participation moment believe your power tapi ease amin
6757,9383,9383,23482,562535689502199808,2015-02-03 08:58:54+00:00,https://twitter.com/__Bungs/status/562535689502199808,"Although often follows the spiritual worship but your heart is not sincere, it will not change anything",0,0,0,,914271535.0,__Bungs,Indonesia,3788.0,1449.0,459936.0,105430.0,although often follows spiritual worship your heart sincere will change anything
