,Unnamed: 0.1,Unnamed: 0,index,Id,Tweet Time,Url,Tweet Text,Likes Count,Reply Count,Retweet Count,Retweeted Tweet,User Id,User Name,User Location,User Follower Count,User Following Count,User Likes Count,User Tweets Count,text_clean
7412,10199,10199,22774,566719764211306496,2015-02-14 22:04:55+00:00,https://twitter.com/__Bungs/status/566719764211306496,"We are free to determine the belief, but only the most important, BELIEVE IN GOD",1,0,0,,914271535.0,__Bungs,Indonesia,3788.0,1449.0,459936.0,105430.0,free tapi determine belief only paling important believe
7413,10200,10200,22773,566721438485192705,2015-02-14 22:11:34+00:00,https://twitter.com/__Bungs/status/566721438485192705,"An angel did not obey God and eventually have to abide by the power of God and live in darkness, that Lucifer, how people who do not obey?",1,0,0,,914271535.0,__Bungs,Indonesia,3788.0,1449.0,459936.0,105430.0,angel obey eventually have tapi abide power live darkness that lucifer people obey
7414,10201,10201,22772,566723819956498433,2015-02-14 22:21:02+00:00,https://twitter.com/__Bungs/status/566723819956498433,Human choice not promising but God choice so holy,2,0,0,,914271535.0,__Bungs,Indonesia,3788.0,1449.0,459936.0,105430.0,human choice promising choice holy
7415,10202,10202,22771,566724674369777664,2015-02-14 22:24:26+00:00,https://twitter.com/__Bungs/status/566724674369777664,"Faith establish the truth in life, what we do or do not",2,0,0,,914271535.0,__Bungs,Indonesia,3788.0,1449.0,459936.0,105430.0,faith establish truth life what orang
7416,10203,10203,22770,566725550320807938,2015-02-14 22:27:55+00:00,https://twitter.com/__Bungs/status/566725550320807938,"Hope will come when trust in the Lord, we live in hope for Him",2,0,1,,914271535.0,__Bungs,Indonesia,3788.0,1449.0,459936.0,105430.0,hope will come when trust lord live hope
7417,10204,10204,22769,566726080136871936,2015-02-14 22:30:01+00:00,https://twitter.com/__Bungs/status/566726080136871936,Good people will rise up in righteousness and evil people will not be raised,3,0,1,,914271535.0,__Bungs,Indonesia,3788.0,1449.0,459936.0,105430.0,bagus people will rise righteousness evil people will raised
7418,10205,10205,22768,566728230577504256,2015-02-14 22:38:34+00:00,https://twitter.com/__Bungs/status/566728230577504256,Surviving in each suffering is a victory in the name of God,1,0,0,,914271535.0,__Bungs,Indonesia,3788.0,1449.0,459936.0,105430.0,surviving each suffering menang name
7419,10206,10206,22767,566730531589459968,2015-02-14 22:47:42+00:00,https://twitter.com/__Bungs/status/566730531589459968,"Bring all your burdens in prayer that God will answer, give your time to God that He would reach every your case",2,0,0,,914271535.0,__Bungs,Indonesia,3788.0,1449.0,459936.0,105430.0,bring your burdens prayer that will answer give your time tapi that would reach every your case
7420,10207,10207,22766,566731355992518656,2015-02-14 22:50:59+00:00,https://twitter.com/__Bungs/status/566731355992518656,"If we like to read the Bible, in which there is a parable and ponder, its meaning is very good for us..God bless, Amen",2,0,1,,914271535.0,__Bungs,Indonesia,3788.0,1449.0,459936.0,105430.0,like tapi read bible which there parable ponder meaning very bagus bless amin
7421,10208,10208,22765,566732517416251393,2015-02-14 22:55:36+00:00,https://twitter.com/__Bungs/status/566732517416251393,Conquer the darkness that inhibit in your soul so that the light in your heart not extinguished,0,0,0,,914271535.0,__Bungs,Indonesia,3788.0,1449.0,459936.0,105430.0,conquer darkness that inhibit your soul that terang your heart extinguished
7422,10209,10209,22764,566738009580515328,2015-02-14 23:17:25+00:00,https://twitter.com/__Bungs/status/566738009580515328,"The wicked man earns deceptive wages, but he who sows righteousness reaps a sure reward. -Proverbs 11:18",2,0,0,,914271535.0,__Bungs,Indonesia,3788.0,1449.0,459936.0,105430.0,wicked earns deceptive wages sows righteousness reaps sure reward proverbs
7423,10210,10210,22763,566738629096402944,2015-02-14 23:19:53+00:00,https://twitter.com/__Bungs/status/566738629096402944,"Pride goes before destruction, a haughty spirit before a fall. -Proverbs 16:18",1,0,0,,914271535.0,__Bungs,Indonesia,3788.0,1449.0,459936.0,105430.0,pride goes before destruction haughty spirit before fall proverbs
7424,10211,10211,22762,566738815994195968,2015-02-14 23:20:37+00:00,https://twitter.com/__Bungs/status/566738815994195968,"For I will restore health to you, &amp; your wounds I will heal. -Jeremiah 30.17",1,0,0,,914271535.0,__Bungs,Indonesia,3788.0,1449.0,459936.0,105430.0,will restore health tapi your wounds will heal jeremiah
7425,10212,10212,22761,566739182651838464,2015-02-14 23:22:05+00:00,https://twitter.com/__Bungs/status/566739182651838464,Those who hope in the LORD will renew their strength. They will soar on wings like eagles. -Isaiah 40:31,1,0,0,,914271535.0,__Bungs,Indonesia,3788.0,1449.0,459936.0,105430.0,those hope lord will renew their strength they will soar wings like eagles isaiah
7426,10213,10213,22760,566739502320734209,2015-02-14 23:23:21+00:00,https://twitter.com/__Bungs/status/566739502320734209,"And He told them a parable, to the effect that they ought always to pray and not lose heart. -Luke 18:1",0,0,0,,914271535.0,__Bungs,Indonesia,3788.0,1449.0,459936.0,105430.0,told them parable tapi effect that they ought always tapi pray lose heart luke
7427,10214,10214,22759,566740578918862848,2015-02-14 23:27:38+00:00,https://twitter.com/__Bungs/status/566740578918862848,Give what is Caesar's to Caesar; and give what is God's to God. -Matthew 22:21,0,0,0,,914271535.0,__Bungs,Indonesia,3788.0,1449.0,459936.0,105430.0,give what caesar tapi caesar give what tapi matthew
7428,10215,10215,22758,566740937720598529,2015-02-14 23:29:03+00:00,https://twitter.com/__Bungs/status/566740937720598529,Don’t let the flooding water engulf me. Don’t let the depths swallow me. Don’t let a grave close its mouth over me - Psalm 69:15,0,0,0,,914271535.0,__Bungs,Indonesia,3788.0,1449.0,459936.0,105430.0,flooding water engulf depths swallow grave close mouth over psalm
7429,10216,10216,22757,566741405213548545,2015-02-14 23:30:55+00:00,https://twitter.com/__Bungs/status/566741405213548545,"I am yours. Save me, because I seek your precepts - Psalm 119:94 http://t.co/CGHBAkZI99",4,0,1,,914271535.0,__Bungs,Indonesia,3788.0,1449.0,459936.0,105430.0,sama yours save because seek your precepts psalm
7430,10218,10218,22756,566754567191162882,2015-02-15 00:23:13+00:00,https://twitter.com/__Bungs/status/566754567191162882,Reaching hope to establish the meaning of fidelity in each togetherness,2,0,1,,914271535.0,__Bungs,Indonesia,3788.0,1449.0,459936.0,105430.0,reaching hope tapi establish meaning fidelity each togetherness
7431,10219,10219,22755,566757021148405761,2015-02-15 00:32:58+00:00,https://twitter.com/__Bungs/status/566757021148405761,"Believing in God makes us healthy, peaceful and loving, and pray to Him makes us joy",2,0,0,,914271535.0,__Bungs,Indonesia,3788.0,1449.0,459936.0,105430.0,believing makes healthy peaceful loving pray tapi makes
7432,10220,10220,22754,566761930807721984,2015-02-15 00:52:28+00:00,https://twitter.com/__Bungs/status/566761930807721984,"Do not tired hoping to God, and do not forget to pray, because the hope and prayer is the key to life in God",1,0,0,,914271535.0,__Bungs,Indonesia,3788.0,1449.0,459936.0,105430.0,tired hoping tapi forget tapi pray because hope prayer tapi life
7433,10222,10222,22753,566905247486844928,2015-02-15 10:21:58+00:00,https://twitter.com/__Bungs/status/566905247486844928,"Happy sunday to everyone, God bless",2,0,1,,914271535.0,__Bungs,Indonesia,3788.0,1449.0,459936.0,105430.0,bahagia sunday tapi everyone bless
7434,10223,10223,22752,566908803707183106,2015-02-15 10:36:06+00:00,https://twitter.com/__Bungs/status/566908803707183106,This humble man called out and the Lord heard him and saved him - Psalm 34:6,0,0,0,,914271535.0,__Bungs,Indonesia,3788.0,1449.0,459936.0,105430.0,this humble called lord heard saved psalm
7435,10224,10224,22751,566909201482412032,2015-02-15 10:37:40+00:00,https://twitter.com/__Bungs/status/566909201482412032,Don’t trust in deceit and in robbery - Psalm 62:10,0,0,0,,914271535.0,__Bungs,Indonesia,3788.0,1449.0,459936.0,105430.0,trust deceit robbery psalm
7436,10225,10225,22750,566909366033346560,2015-02-15 10:38:20+00:00,https://twitter.com/__Bungs/status/566909366033346560,May the Lord’s impressive status endure for a long time. May the Lord rejoice in his created beings - Psalm 104:31,0,0,0,,914271535.0,__Bungs,Indonesia,3788.0,1449.0,459936.0,105430.0,lord impressive status endure long time lord rejoice created beings psalm
7437,10226,10226,22749,566909447545425921,2015-02-15 10:38:39+00:00,https://twitter.com/__Bungs/status/566909447545425921,"The king rejoices in your strength, Lord. How greatly he rejoices in your salvation - Psalm 21:1",0,0,0,,914271535.0,__Bungs,Indonesia,3788.0,1449.0,459936.0,105430.0,king rejoices your strength lord greatly rejoices your salvation psalm
7438,10227,10227,22748,566909780854206464,2015-02-15 10:39:59+00:00,https://twitter.com/__Bungs/status/566909780854206464,"Lord, remember your deep love and your loyalty - Psalm 25:6",0,0,0,,914271535.0,__Bungs,Indonesia,3788.0,1449.0,459936.0,105430.0,lord remember your deep cinta your loyalty psalm
7439,10228,10228,22747,566919418077130753,2015-02-15 11:18:16+00:00,https://twitter.com/__Bungs/status/566919418077130753,"To be perfect, not as easy to learn of something",0,0,0,,914271535.0,__Bungs,Indonesia,3788.0,1449.0,459936.0,105430.0,tapi perfect easy tapi learn something
7440,10229,10229,22746,566941969612427264,2015-02-15 12:47:53+00:00,https://twitter.com/__Bungs/status/566941969612427264,"Do not look in the mirror of the past, still thankful what we get to achieve future",0,0,0,,914271535.0,__Bungs,Indonesia,3788.0,1449.0,459936.0,105430.0,look mirror pasti masih thankful what tapi achieve future
7441,10230,10230,22745,566946066524688386,2015-02-15 13:04:10+00:00,https://twitter.com/__Bungs/status/566946066524688386,Praying for others will be many miracles come to us,0,0,0,,914271535.0,__Bungs,Indonesia,3788.0,1449.0,459936.0,105430.0,praying others will many miracles come tapi
7442,10232,10232,22743,566958590548643842,2015-02-15 13:53:56+00:00,https://twitter.com/__Bungs/status/566958590548643842,The work of each will become visible. The Day will expose it - 1 Corinthians 3:13 http://t.co/cSafrzMTAa,1,0,0,,914271535.0,__Bungs,Indonesia,3788.0,1449.0,459936.0,105430.0,work each will become visible will expose corinthians
7443,10234,10234,22741,566965042675855361,2015-02-15 14:19:34+00:00,https://twitter.com/__Bungs/status/566965042675855361,Eternal life is a life faithful to God until the time,0,0,0,,914271535.0,__Bungs,Indonesia,3788.0,1449.0,459936.0,105430.0,eternal life life faithful tapi until time
7444,10235,10235,22740,566965525905817600,2015-02-15 14:21:29+00:00,https://twitter.com/__Bungs/status/566965525905817600,"God is leading our heart and soul, joy part of God's gift",1,0,0,,914271535.0,__Bungs,Indonesia,3788.0,1449.0,459936.0,105430.0,leading kami heart soul part gift
7445,10236,10236,22739,566967423698366464,2015-02-15 14:29:02+00:00,https://twitter.com/__Bungs/status/566967423698366464,"Hope is in want, but do not become anything, it's not ours",0,0,0,,914271535.0,__Bungs,Indonesia,3788.0,1449.0,459936.0,105430.0,hope want become anything ours
7446,10237,10237,22738,566968710636650496,2015-02-15 14:34:09+00:00,https://twitter.com/__Bungs/status/566968710636650496,Holy Spirit leads us in devotion and prayer to God,1,0,0,,914271535.0,__Bungs,Indonesia,3788.0,1449.0,459936.0,105430.0,holy spirit leads devotion prayer tapi
7447,10238,10238,22737,566970106412937217,2015-02-15 14:39:41+00:00,https://twitter.com/__Bungs/status/566970106412937217,"Receive God's blessing today and forever, raise praise Him unconditionally",0,0,0,,914271535.0,__Bungs,Indonesia,3788.0,1449.0,459936.0,105430.0,receive blessing today forever raise praise unconditionally
7448,10239,10239,22736,566970602372608000,2015-02-15 14:41:40+00:00,https://twitter.com/__Bungs/status/566970602372608000,God gives life on earth with a full gift,0,0,0,,914271535.0,__Bungs,Indonesia,3788.0,1449.0,459936.0,105430.0,gives life earth dengan full gift
7449,10240,10240,22735,566970988923858945,2015-02-15 14:43:12+00:00,https://twitter.com/__Bungs/status/566970988923858945,"Do not look for perfection of man, because only God's perfect",0,0,0,,914271535.0,__Bungs,Indonesia,3788.0,1449.0,459936.0,105430.0,look perfection because only perfect
7450,10241,10241,22734,566971169828401154,2015-02-15 14:43:55+00:00,https://twitter.com/__Bungs/status/566971169828401154,God is Holy..He give us a life,1,0,0,,914271535.0,__Bungs,Indonesia,3788.0,1449.0,459936.0,105430.0,holy give life
7451,10242,10242,22733,566971698319065088,2015-02-15 14:46:01+00:00,https://twitter.com/__Bungs/status/566971698319065088,The promise of God is proof of His plan to us,1,0,0,,914271535.0,__Bungs,Indonesia,3788.0,1449.0,459936.0,105430.0,promise proof plan tapi
7452,10243,10243,22732,566972049147453440,2015-02-15 14:47:25+00:00,https://twitter.com/__Bungs/status/566972049147453440,Remain grateful and give the best to the Lord,1,0,0,,914271535.0,__Bungs,Indonesia,3788.0,1449.0,459936.0,105430.0,remain grateful give best tapi lord
7453,10244,10244,22731,566972787676282882,2015-02-15 14:50:21+00:00,https://twitter.com/__Bungs/status/566972787676282882,"God will frustrate our plan, if the plan was not holy in His presence",0,0,0,,914271535.0,__Bungs,Indonesia,3788.0,1449.0,459936.0,105430.0,will frustrate kami plan plan holy presence
7454,10245,10245,22730,566972954118856705,2015-02-15 14:51:00+00:00,https://twitter.com/__Bungs/status/566972954118856705,Holy spirit with me everytime,1,0,0,,914271535.0,__Bungs,Indonesia,3788.0,1449.0,459936.0,105430.0,holy spirit dengan everytime
7455,10246,10246,22729,566973345107673089,2015-02-15 14:52:33+00:00,https://twitter.com/__Bungs/status/566973345107673089,"Do not just talk but do your best, do not only see but share what we have",0,0,0,,914271535.0,__Bungs,Indonesia,3788.0,1449.0,459936.0,105430.0,just talk your best only share what have
7456,10247,10247,22728,566974006360670208,2015-02-15 14:55:11+00:00,https://twitter.com/__Bungs/status/566974006360670208,"We can breathe because of God, we can pray cause  holy spirit, without trust, faith has no meaning",0,0,0,,914271535.0,__Bungs,Indonesia,3788.0,1449.0,459936.0,105430.0,belum breathe because belum pray cause holy spirit without trust faith nomor meaning
7457,10248,10248,22727,566974794071932928,2015-02-15 14:58:19+00:00,https://twitter.com/__Bungs/status/566974794071932928,"I only fear God, not to good people",1,0,0,,914271535.0,__Bungs,Indonesia,3788.0,1449.0,459936.0,105430.0,only fear tapi bagus people
7458,10249,10249,22726,566975978233028608,2015-02-15 15:03:01+00:00,https://twitter.com/__Bungs/status/566975978233028608,I love you Jesus..your miracle so real ♥♡,1,0,1,,914271535.0,__Bungs,Indonesia,3788.0,1449.0,459936.0,105430.0,cinta jesus your miracle real
7459,10250,10250,22725,566976756846850048,2015-02-15 15:06:07+00:00,https://twitter.com/__Bungs/status/566976756846850048,"Hope to be real, when praying earnestly",0,0,0,,914271535.0,__Bungs,Indonesia,3788.0,1449.0,459936.0,105430.0,hope tapi real when praying earnestly
7460,10251,10251,22724,566981668095795200,2015-02-15 15:25:38+00:00,https://twitter.com/__Bungs/status/566981668095795200,"All humans have a problem in life, nothing is perfect, ask God to change your life",2,0,0,,914271535.0,__Bungs,Indonesia,3788.0,1449.0,459936.0,105430.0,humans have masalah life nothing perfect tapi change your life
7461,10252,10252,22723,566982627442192384,2015-02-15 15:29:27+00:00,https://twitter.com/__Bungs/status/566982627442192384,"I do not need to be respected or praised, I am a human being blessed by God, I serve God and pray for others",1,0,0,,914271535.0,__Bungs,Indonesia,3788.0,1449.0,459936.0,105430.0,need tapi respected orang praised sama human being blessed serve pray others
7462,10253,10253,22722,566983033513709568,2015-02-15 15:31:03+00:00,https://twitter.com/__Bungs/status/566983033513709568,"Taking the rights of others will perish, sharing with others will be abundant blessings",0,0,0,,914271535.0,__Bungs,Indonesia,3788.0,1449.0,459936.0,105430.0,taking benar others will perish sharing dengan others will abundant blessings
7463,10254,10254,22721,566983415207960576,2015-02-15 15:32:34+00:00,https://twitter.com/__Bungs/status/566983415207960576,"I helped with volunteer for humans, animals and nature, I believe in God and filled with the holy spirit fire",0,0,0,,914271535.0,__Bungs,Indonesia,3788.0,1449.0,459936.0,105430.0,helped dengan volunteer humans animals nature believe filled dengan holy spirit fire
7464,10255,10255,22720,566983821665370112,2015-02-15 15:34:11+00:00,https://twitter.com/__Bungs/status/566983821665370112,"I am doing the Lord's command unconditionally, I always look forward to all be well and happy",0,0,0,,914271535.0,__Bungs,Indonesia,3788.0,1449.0,459936.0,105430.0,sama doing lord command unconditionally always look forward tapi well bahagia
7465,10256,10256,22719,566984637679816705,2015-02-15 15:37:26+00:00,https://twitter.com/__Bungs/status/566984637679816705,"Stepping with sincerity will see the truth, God is always with us",0,0,0,,914271535.0,__Bungs,Indonesia,3788.0,1449.0,459936.0,105430.0,stepping dengan sincerity will truth always dengan
7466,10257,10257,22718,566985812793774080,2015-02-15 15:42:06+00:00,https://twitter.com/__Bungs/status/566985812793774080,"True Christians, live help each other with love",1,0,0,,914271535.0,__Bungs,Indonesia,3788.0,1449.0,459936.0,105430.0,true christians live help each other dengan cinta
7467,10258,10258,22717,566988765856403456,2015-02-15 15:53:50+00:00,https://twitter.com/__Bungs/status/566988765856403456,"God takes care of us and give us a miracle, what we ask of God, all will be given",0,0,0,,914271535.0,__Bungs,Indonesia,3788.0,1449.0,459936.0,105430.0,takes care give miracle what will given
7468,10259,10259,22716,566988967799562241,2015-02-15 15:54:38+00:00,https://twitter.com/__Bungs/status/566988967799562241,"If you dont trust in God, You are nothing in the world",0,0,0,,914271535.0,__Bungs,Indonesia,3788.0,1449.0,459936.0,105430.0,dont trust nothing world
7469,10260,10260,22715,566991561976582144,2015-02-15 16:04:57+00:00,https://twitter.com/__Bungs/status/566991561976582144,What is contained in the Bible is the truth for us who believe in Jesus,0,0,0,,914271535.0,__Bungs,Indonesia,3788.0,1449.0,459936.0,105430.0,what contained bible truth believe jesus
7470,10261,10261,22714,566992406461960192,2015-02-15 16:08:18+00:00,https://twitter.com/__Bungs/status/566992406461960192,"We as a witness of the goodness of the Lord, and do not be shy and hesitant spread the Good Lord",1,0,0,,914271535.0,__Bungs,Indonesia,3788.0,1449.0,459936.0,105430.0,witness goodness lord hesitant spread bagus lord
7471,10262,10262,22713,566993431126241280,2015-02-15 16:12:22+00:00,https://twitter.com/__Bungs/status/566993431126241280,"We are children of God, blessed and baptized in His name, by Him we are saved",1,0,0,,914271535.0,__Bungs,Indonesia,3788.0,1449.0,459936.0,105430.0,children blessed baptized name saved
7472,10264,10264,22711,567030430507888641,2015-02-15 18:39:24+00:00,https://twitter.com/__Bungs/status/567030430507888641,Whoever’s name was not found written in the Book of Life was thrown into the burning lake - Revelation 20:15 http://t.co/Mm8R8js4e0,0,0,0,,914271535.0,__Bungs,Indonesia,3788.0,1449.0,459936.0,105430.0,whoever name found written book life thrown into burning lake revelation
7473,10265,10265,22710,567033521152065537,2015-02-15 18:51:41+00:00,https://twitter.com/__Bungs/status/567033521152065537,The angel showed me a river of life-giving water which sparkled like crystal - Revelation 22:1 http://t.co/sHqfH8mPHs,1,0,0,,914271535.0,__Bungs,Indonesia,3788.0,1449.0,459936.0,105430.0,angel showed river life giving water which sparkled like crystal revelation
7474,10267,10267,22708,567058114428411904,2015-02-15 20:29:24+00:00,https://twitter.com/__Bungs/status/567058114428411904,Enlightenment faith through prayer,0,0,0,,914271535.0,__Bungs,Indonesia,3788.0,1449.0,459936.0,105430.0,enlightenment faith through prayer
7475,10268,10268,22707,567058967658913792,2015-02-15 20:32:47+00:00,https://twitter.com/__Bungs/status/567058967658913792,"Love makes us aware, what is the meaning of life, God is in each case",1,0,1,,914271535.0,__Bungs,Indonesia,3788.0,1449.0,459936.0,105430.0,cinta makes aware what meaning life each case
7476,10269,10269,22706,567065215485739009,2015-02-15 20:57:37+00:00,https://twitter.com/__Bungs/status/567065215485739009,"Jesus said, ""I will give those who overcome the right to eat from the life-giving tree which is in God’s garden"" - Revelation 2:7",0,0,0,,914271535.0,__Bungs,Indonesia,3788.0,1449.0,459936.0,105430.0,jesus said will give those overcome right tapi from life giving tree which garden revelation
7477,10270,10270,22705,567065450480021504,2015-02-15 20:58:33+00:00,https://twitter.com/__Bungs/status/567065450480021504,"""In the last days,"" says God, ""I will pour out my Spirit on all people"" - Acts 2:17 http://t.co/Zu6lmi89tQ",1,0,0,,914271535.0,__Bungs,Indonesia,3788.0,1449.0,459936.0,105430.0,last days says will pour spirit people acts
7478,10271,10271,22704,567065676947279872,2015-02-15 20:59:27+00:00,https://twitter.com/__Bungs/status/567065676947279872,"A trumpet will sound, the dead will be raised imperishable, and we will be transformed - 1 Corinthians 15:52 http://t.co/GcbO6THKkt",1,0,0,,914271535.0,__Bungs,Indonesia,3788.0,1449.0,459936.0,105430.0,trumpet will sound dead will raised imperishable will transformed corinthians
7479,10273,10273,22702,567069757690494976,2015-02-15 21:15:40+00:00,https://twitter.com/__Bungs/status/567069757690494976,"There’ll be blood, fire and clouds of smoke, before the coming of the great and glorious day of the Lord-Acts 2:18-19 http://t.co/Gr8PEcxhNi",2,0,0,,914271535.0,__Bungs,Indonesia,3788.0,1449.0,459936.0,105430.0,there blood fire clouds smoke before coming great glorious lord acts
7480,10274,10274,22701,567074933864296448,2015-02-15 21:36:14+00:00,https://twitter.com/__Bungs/status/567074933864296448,"""Try to be a rainbow in someone's cloud."" -Maya Angelou http://t.co/RptmWq7WVL",1,0,0,,914271535.0,__Bungs,Indonesia,3788.0,1449.0,459936.0,105430.0,tapi rainbow someone cloud maya angelou
7481,10276,10276,22699,567076981242474497,2015-02-15 21:44:22+00:00,https://twitter.com/__Bungs/status/567076981242474497,"We are one body in Christ is we are part of the body of Jesus, if we do not obey, he will be sad, when we are obedient, He will visit us",0,0,0,,914271535.0,__Bungs,Indonesia,3788.0,1449.0,459936.0,105430.0,body christ part body jesus obey will when obedient will visit
7482,10277,10277,22698,567077929771741185,2015-02-15 21:48:08+00:00,https://twitter.com/__Bungs/status/567077929771741185,We live not to falter but we have hope to rise,0,0,0,,914271535.0,__Bungs,Indonesia,3788.0,1449.0,459936.0,105430.0,live tapi falter have hope tapi rise
7483,10278,10278,22697,567079268744589312,2015-02-15 21:53:28+00:00,https://twitter.com/__Bungs/status/567079268744589312,"Pray for being sick, for being anxious and hopeless, that God touched them with His stripes love",1,0,0,,914271535.0,__Bungs,Indonesia,3788.0,1449.0,459936.0,105430.0,pray being sick being anxious hopeless that touched them dengan stripes cinta
7484,10279,10279,22696,567080069336530944,2015-02-15 21:56:39+00:00,https://twitter.com/__Bungs/status/567080069336530944,"We should be able to explain to others the meaning of the Bible verse, so that all believers enlightened in joy with the Lord",1,0,0,,914271535.0,__Bungs,Indonesia,3788.0,1449.0,459936.0,105430.0,should able tapi explain tapi others meaning bible verse that believers enlightened dengan lord
7485,10280,10280,22695,567080602185125888,2015-02-15 21:58:46+00:00,https://twitter.com/__Bungs/status/567080602185125888,"Sowing prayer in every hope will reap miracles, many are praying that all be good",1,0,0,,914271535.0,__Bungs,Indonesia,3788.0,1449.0,459936.0,105430.0,sowing prayer every hope will reap miracles many praying that bagus
7486,10281,10281,22694,567081025906282496,2015-02-15 22:00:27+00:00,https://twitter.com/__Bungs/status/567081025906282496,"Do not use insight to yourself, but share and distribute to those who do not understand",0,0,0,,914271535.0,__Bungs,Indonesia,3788.0,1449.0,459936.0,105430.0,insight tapi yourself share distribute tapi those understand
7487,10283,10283,22693,567081807296729089,2015-02-15 22:03:33+00:00,https://twitter.com/__Bungs/status/567081807296729089,"Your prayer is more valuable than money, because money does not educate people so good, simple live without burdening others",0,0,0,,914271535.0,__Bungs,Indonesia,3788.0,1449.0,459936.0,105430.0,your prayer more valuable tahan money because money does educate people bagus simple live without burdening others
7488,10284,10284,22692,567082660418166784,2015-02-15 22:06:56+00:00,https://twitter.com/__Bungs/status/567082660418166784,"Do not look at other people than skin deep, but from good intentions to survive",0,0,0,,914271535.0,__Bungs,Indonesia,3788.0,1449.0,459936.0,105430.0,look other people tahan skin deep from bagus intentions tapi survive
7489,10285,10285,22691,567083496766599169,2015-02-15 22:10:16+00:00,https://twitter.com/__Bungs/status/567083496766599169,God does not see us as diligent worship but of sincere devotion,0,0,0,,914271535.0,__Bungs,Indonesia,3788.0,1449.0,459936.0,105430.0,does diligent worship sincere devotion
